Sheet: Sheet1
A1: General | B1: 1 | C1: -1.2 | D1: 12.3 | E1: -12.34 | F1: 123.45 | G1: -123.456 | H1: 1234.567 | I1: -1234.5678 | J1: 12345.678900000001
A2: GENERAL | B2: =R[-1]C -> 1 | C2: =R[-1]C -> -1.2 | D2: =R[-1]C -> 12.3 | E2: =R[-1]C -> -12.34 | F2: =R[-1]C -> 123.45 | G2: =R[-1]C -> -123.456 | H2: =R[-1]C -> 1234.567 | I2: =R[-1]C -> -1234.5678 | J2: =R[-1]C -> 12345.678900000001
A3: YY | B3: =R[-1]C -> 1900-01-01T00:00:00.000 | C3: =R[-1]C -> 1899-12-29T19:12:00.000 | D3: =R[-1]C -> 1900-01-12T07:12:00.000 | E3: =R[-1]C -> 1899-12-18T15:50:24.000 | F3: =R[-1]C -> 1900-05-02T10:48:00.000 | G3: =R[-1]C -> 1899-08-29T13:03:21.600 | H3: =R[-1]C -> 1903-05-18T13:36:28.800 | I3: =R[-1]C -> 1896-08-13T10:22:22.080 | J3: =R[-1]C -> 1933-10-18T16:17:36.960
A4: YYYY | B4: =R[-1]C -> 1900-01-01T00:00:00.000 | C4: =R[-1]C -> 1899-12-29T19:12:00.000 | D4: =R[-1]C -> 1900-01-12T07:12:00.000 | E4: =R[-1]C -> 1899-12-18T15:50:24.000 | F4: =R[-1]C -> 1900-05-02T10:48:00.000 | G4: =R[-1]C -> 1899-08-29T13:03:21.600 | H4: =R[-1]C -> 1903-05-18T13:36:28.800 | I4: =R[-1]C -> 1896-08-13T10:22:22.080 | J4: =R[-1]C -> 1933-10-18T16:17:36.960
A5: YYM | B5: =R[-1]C -> 1900-01-01T00:00:00.000 | C5: =R[-1]C -> 1899-12-29T19:12:00.000 | D5: =R[-1]C -> 1900-01-12T07:12:00.000 | E5: =R[-1]C -> 1899-12-18T15:50:24.000 | F5: =R[-1]C -> 1900-05-02T10:48:00.000 | G5: =R[-1]C -> 1899-08-29T13:03:21.600 | H5: =R[-1]C -> 1903-05-18T13:36:28.800 | I5: =R[-1]C -> 1896-08-13T10:22:22.080 | J5: =R[-1]C -> 1933-10-18T16:17:36.960
A6: YYMM | B6: =R[-1]C -> 1900-01-01T00:00:00.000 | C6: =R[-1]C -> 1899-12-29T19:12:00.000 | D6: =R[-1]C -> 1900-01-12T07:12:00.000 | E6: =R[-1]C -> 1899-12-18T15:50:24.000 | F6: =R[-1]C -> 1900-05-02T10:48:00.000 | G6: =R[-1]C -> 1899-08-29T13:03:21.600 | H6: =R[-1]C -> 1903-05-18T13:36:28.800 | I6: =R[-1]C -> 1896-08-13T10:22:22.080 | J6: =R[-1]C -> 1933-10-18T16:17:36.960
A7: YYMMM | B7: =R[-1]C -> 1900-01-01T00:00:00.000 | C7: =R[-1]C -> 1899-12-29T19:12:00.000 | D7: =R[-1]C -> 1900-01-12T07:12:00.000 | E7: =R[-1]C -> 1899-12-18T15:50:24.000 | F7: =R[-1]C -> 1900-05-02T10:48:00.000 | G7: =R[-1]C -> 1899-08-29T13:03:21.600 | H7: =R[-1]C -> 1903-05-18T13:36:28.800 | I7: =R[-1]C -> 1896-08-13T10:22:22.080 | J7: =R[-1]C -> 1933-10-18T16:17:36.960
A8: YYMMMM | B8: =R[-1]C -> 1900-01-01T00:00:00.000 | C8: =R[-1]C -> 1899-12-29T19:12:00.000 | D8: =R[-1]C -> 1900-01-12T07:12:00.000 | E8: =R[-1]C -> 1899-12-18T15:50:24.000 | F8: =R[-1]C -> 1900-05-02T10:48:00.000 | G8: =R[-1]C -> 1899-08-29T13:03:21.600 | H8: =R[-1]C -> 1903-05-18T13:36:28.800 | I8: =R[-1]C -> 1896-08-13T10:22:22.080 | J8: =R[-1]C -> 1933-10-18T16:17:36.960
A9: YYMMMMM | B9: =R[-1]C -> 1900-01-01T00:00:00.000 | C9: =R[-1]C -> 1899-12-29T19:12:00.000 | D9: =R[-1]C -> 1900-01-12T07:12:00.000 | E9: =R[-1]C -> 1899-12-18T15:50:24.000 | F9: =R[-1]C -> 1900-05-02T10:48:00.000 | G9: =R[-1]C -> 1899-08-29T13:03:21.600 | H9: =R[-1]C -> 1903-05-18T13:36:28.800 | I9: =R[-1]C -> 1896-08-13T10:22:22.080 | J9: =R[-1]C -> 1933-10-18T16:17:36.960
A10: D | B10: =R[-1]C -> 1900-01-01T00:00:00.000 | C10: =R[-1]C -> 1899-12-29T19:12:00.000 | D10: =R[-1]C -> 1900-01-12T07:12:00.000 | E10: =R[-1]C -> 1899-12-18T15:50:24.000 | F10: =R[-1]C -> 1900-05-02T10:48:00.000 | G10: =R[-1]C -> 1899-08-29T13:03:21.600 | H10: =R[-1]C -> 1903-05-18T13:36:28.800 | I10: =R[-1]C -> 1896-08-13T10:22:22.080 | J10: =R[-1]C -> 1933-10-18T16:17:36.960
A11: DD | B11: =R[-1]C -> 1900-01-01T00:00:00.000 | C11: =R[-1]C -> 1899-12-29T19:12:00.000 | D11: =R[-1]C -> 1900-01-12T07:12:00.000 | E11: =R[-1]C -> 1899-12-18T15:50:24.000 | F11: =R[-1]C -> 1900-05-02T10:48:00.000 | G11: =R[-1]C -> 1899-08-29T13:03:21.600 | H11: =R[-1]C -> 1903-05-18T13:36:28.800 | I11: =R[-1]C -> 1896-08-13T10:22:22.080 | J11: =R[-1]C -> 1933-10-18T16:17:36.960
A12: DDD | B12: =R[-1]C -> 1900-01-01T00:00:00.000 | C12: =R[-1]C -> 1899-12-29T19:12:00.000 | D12: =R[-1]C -> 1900-01-12T07:12:00.000 | E12: =R[-1]C -> 1899-12-18T15:50:24.000 | F12: =R[-1]C -> 1900-05-02T10:48:00.000 | G12: =R[-1]C -> 1899-08-29T13:03:21.600 | H12: =R[-1]C -> 1903-05-18T13:36:28.800 | I12: =R[-1]C -> 1896-08-13T10:22:22.080 | J12: =R[-1]C -> 1933-10-18T16:17:36.960
A13: DDDD | B13: =R[-1]C -> 1900-01-01T00:00:00.000 | C13: =R[-1]C -> 1899-12-29T19:12:00.000 | D13: =R[-1]C -> 1900-01-12T07:12:00.000 | E13: =R[-1]C -> 1899-12-18T15:50:24.000 | F13: =R[-1]C -> 1900-05-02T10:48:00.000 | G13: =R[-1]C -> 1899-08-29T13:03:21.600 | H13: =R[-1]C -> 1903-05-18T13:36:28.800 | I13: =R[-1]C -> 1896-08-13T10:22:22.080 | J13: =R[-1]C -> 1933-10-18T16:17:36.960
A14: H | B14: =R[-1]C -> 1900-01-01T00:00:00.000 | C14: =R[-1]C -> 1899-12-29T19:12:00.000 | D14: =R[-1]C -> 1900-01-12T07:12:00.000 | E14: =R[-1]C -> 1899-12-18T15:50:24.000 | F14: =R[-1]C -> 1900-05-02T10:48:00.000 | G14: =R[-1]C -> 1899-08-29T13:03:21.600 | H14: =R[-1]C -> 1903-05-18T13:36:28.800 | I14: =R[-1]C -> 1896-08-13T10:22:22.080 | J14: =R[-1]C -> 1933-10-18T16:17:36.960
A15: HH | B15: =R[-1]C -> 1900-01-01T00:00:00.000 | C15: =R[-1]C -> 1899-12-29T19:12:00.000 | D15: =R[-1]C -> 1900-01-12T07:12:00.000 | E15: =R[-1]C -> 1899-12-18T15:50:24.000 | F15: =R[-1]C -> 1900-05-02T10:48:00.000 | G15: =R[-1]C -> 1899-08-29T13:03:21.600 | H15: =R[-1]C -> 1903-05-18T13:36:28.800 | I15: =R[-1]C -> 1896-08-13T10:22:22.080 | J15: =R[-1]C -> 1933-10-18T16:17:36.960
A16: [H] | B16: =R[-1]C -> 1900-01-01T00:00:00.000 | C16: =R[-1]C -> 1899-12-29T19:12:00.000 | D16: =R[-1]C -> 1900-01-12T07:12:00.000 | E16: =R[-1]C -> 1899-12-18T15:50:24.000 | F16: =R[-1]C -> 1900-05-02T10:48:00.000 | G16: =R[-1]C -> 1899-08-29T13:03:21.600 | H16: =R[-1]C -> 1903-05-18T13:36:28.800 | I16: =R[-1]C -> 1896-08-13T10:22:22.080 | J16: =R[-1]C -> 1933-10-18T16:17:36.960
A17: [HH] | B17: =R[-1]C -> 1900-01-01T00:00:00.000 | C17: =R[-1]C -> 1899-12-29T19:12:00.000 | D17: =R[-1]C -> 1900-01-12T07:12:00.000 | E17: =R[-1]C -> 1899-12-18T15:50:24.000 | F17: =R[-1]C -> 1900-05-02T10:48:00.000 | G17: =R[-1]C -> 1899-08-29T13:03:21.600 | H17: =R[-1]C -> 1903-05-18T13:36:28.800 | I17: =R[-1]C -> 1896-08-13T10:22:22.080 | J17: =R[-1]C -> 1933-10-18T16:17:36.960
A18: HHM | B18: =R[-1]C -> 1900-01-01T00:00:00.000 | C18: =R[-1]C -> 1899-12-29T19:12:00.000 | D18: =R[-1]C -> 1900-01-12T07:12:00.000 | E18: =R[-1]C -> 1899-12-18T15:50:24.000 | F18: =R[-1]C -> 1900-05-02T10:48:00.000 | G18: =R[-1]C -> 1899-08-29T13:03:21.600 | H18: =R[-1]C -> 1903-05-18T13:36:28.800 | I18: =R[-1]C -> 1896-08-13T10:22:22.080 | J18: =R[-1]C -> 1933-10-18T16:17:36.960
A19: HHMM | B19: =R[-1]C -> 1900-01-01T00:00:00.000 | C19: =R[-1]C -> 1899-12-29T19:12:00.000 | D19: =R[-1]C -> 1900-01-12T07:12:00.000 | E19: =R[-1]C -> 1899-12-18T15:50:24.000 | F19: =R[-1]C -> 1900-05-02T10:48:00.000 | G19: =R[-1]C -> 1899-08-29T13:03:21.600 | H19: =R[-1]C -> 1903-05-18T13:36:28.800 | I19: =R[-1]C -> 1896-08-13T10:22:22.080 | J19: =R[-1]C -> 1933-10-18T16:17:36.960
A20: HH[M] | B20: =R[-1]C -> 1 | C20: =R[-1]C -> -1.2 | D20: =R[-1]C -> 12.3 | E20: =R[-1]C -> -12.34 | F20: =R[-1]C -> 123.45 | G20: =R[-1]C -> -123.456 | H20: =R[-1]C -> 1234.567 | I20: =R[-1]C -> -1234.5678 | J20: =R[-1]C -> 12345.678900000001
A21: HH[MM] | B21: =R[-1]C -> 1 | C21: =R[-1]C -> -1.2 | D21: =R[-1]C -> 12.3 | E21: =R[-1]C -> -12.34 | F21: =R[-1]C -> 123.45 | G21: =R[-1]C -> -123.456 | H21: =R[-1]C -> 1234.567 | I21: =R[-1]C -> -1234.5678 | J21: =R[-1]C -> 12345.678900000001
A22: S | B22: =R[-1]C -> 1900-01-01T00:00:00.000 | C22: =R[-1]C -> 1899-12-29T19:12:00.000 | D22: =R[-1]C -> 1900-01-12T07:12:00.000 | E22: =R[-1]C -> 1899-12-18T15:50:24.000 | F22: =R[-1]C -> 1900-05-02T10:48:00.000 | G22: =R[-1]C -> 1899-08-29T13:03:21.600 | H22: =R[-1]C -> 1903-05-18T13:36:28.800 | I22: =R[-1]C -> 1896-08-13T10:22:22.080 | J22: =R[-1]C -> 1933-10-18T16:17:36.960
A23: SS | B23: =R[-1]C -> 1900-01-01T00:00:00.000 | C23: =R[-1]C -> 1899-12-29T19:12:00.000 | D23: =R[-1]C -> 1900-01-12T07:12:00.000 | E23: =R[-1]C -> 1899-12-18T15:50:24.000 | F23: =R[-1]C -> 1900-05-02T10:48:00.000 | G23: =R[-1]C -> 1899-08-29T13:03:21.600 | H23: =R[-1]C -> 1903-05-18T13:36:28.800 | I23: =R[-1]C -> 1896-08-13T10:22:22.080 | J23: =R[-1]C -> 1933-10-18T16:17:36.960
A24: [S] | B24: =R[-1]C -> 1900-01-01T00:00:00.000 | C24: =R[-1]C -> 1899-12-29T19:12:00.000 | D24: =R[-1]C -> 1900-01-12T07:12:00.000 | E24: =R[-1]C -> 1899-12-18T15:50:24.000 | F24: =R[-1]C -> 1900-05-02T10:48:00.000 | G24: =R[-1]C -> 1899-08-29T13:03:21.600 | H24: =R[-1]C -> 1903-05-18T13:36:28.800 | I24: =R[-1]C -> 1896-08-13T10:22:22.080 | J24: =R[-1]C -> 1933-10-18T16:17:36.960
A25: [SS] | B25: =R[-1]C -> 1900-01-01T00:00:00.000 | C25: =R[-1]C -> 1899-12-29T19:12:00.000 | D25: =R[-1]C -> 1900-01-12T07:12:00.000 | E25: =R[-1]C -> 1899-12-18T15:50:24.000 | F25: =R[-1]C -> 1900-05-02T10:48:00.000 | G25: =R[-1]C -> 1899-08-29T13:03:21.600 | H25: =R[-1]C -> 1903-05-18T13:36:28.800 | I25: =R[-1]C -> 1896-08-13T10:22:22.080 | J25: =R[-1]C -> 1933-10-18T16:17:36.960
A26: [BLACK] | B26: =R[-1]C -> 1 | C26: =R[-1]C -> -1.2 | D26: =R[-1]C -> 12.3 | E26: =R[-1]C -> -12.34 | F26: =R[-1]C -> 123.45 | G26: =R[-1]C -> -123.456 | H26: =R[-1]C -> 1234.567 | I26: =R[-1]C -> -1234.5678 | J26: =R[-1]C -> 12345.678900000001
A27: [BLUE] | B27: =R[-1]C -> 1 | C27: =R[-1]C -> -1.2 | D27: =R[-1]C -> 12.3 | E27: =R[-1]C -> -12.34 | F27: =R[-1]C -> 123.45 | G27: =R[-1]C -> -123.456 | H27: =R[-1]C -> 1234.567 | I27: =R[-1]C -> -1234.5678 | J27: =R[-1]C -> 12345.678900000001
A28: [CYAN] | B28: =R[-1]C -> 1 | C28: =R[-1]C -> -1.2 | D28: =R[-1]C -> 12.3 | E28: =R[-1]C -> -12.34 | F28: =R[-1]C -> 123.45 | G28: =R[-1]C -> -123.456 | H28: =R[-1]C -> 1234.567 | I28: =R[-1]C -> -1234.5678 | J28: =R[-1]C -> 12345.678900000001
A29: [GREEN] | B29: =R[-1]C -> 1 | C29: =R[-1]C -> -1.2 | D29: =R[-1]C -> 12.3 | E29: =R[-1]C -> -12.34 | F29: =R[-1]C -> 123.45 | G29: =R[-1]C -> -123.456 | H29: =R[-1]C -> 1234.567 | I29: =R[-1]C -> -1234.5678 | J29: =R[-1]C -> 12345.678900000001
A30: [MAGENTA] | B30: =R[-1]C -> 1 | C30: =R[-1]C -> -1.2 | D30: =R[-1]C -> 12.3 | E30: =R[-1]C -> -12.34 | F30: =R[-1]C -> 123.45 | G30: =R[-1]C -> -123.456 | H30: =R[-1]C -> 1234.567 | I30: =R[-1]C -> -1234.5678 | J30: =R[-1]C -> 12345.678900000001
A31: [RED] | B31: =R[-1]C -> 1 | C31: =R[-1]C -> -1.2 | D31: =R[-1]C -> 12.3 | E31: =R[-1]C -> -12.34 | F31: =R[-1]C -> 123.45 | G31: =R[-1]C -> -123.456 | H31: =R[-1]C -> 1234.567 | I31: =R[-1]C -> -1234.5678 | J31: =R[-1]C -> 12345.678900000001
A32: [WHITE] | B32: =R[-1]C -> 1 | C32: =R[-1]C -> -1.2 | D32: =R[-1]C -> 12.3 | E32: =R[-1]C -> -12.34 | F32: =R[-1]C -> 123.45 | G32: =R[-1]C -> -123.456 | H32: =R[-1]C -> 1234.567 | I32: =R[-1]C -> -1234.5678 | J32: =R[-1]C -> 12345.678900000001
A33: [YELLOW] | B33: =R[-1]C -> 1 | C33: =R[-1]C -> -1.2 | D33: =R[-1]C -> 12.3 | E33: =R[-1]C -> -12.34 | F33: =R[-1]C -> 123.45 | G33: =R[-1]C -> -123.456 | H33: =R[-1]C -> 1234.567 | I33: =R[-1]C -> -1234.5678 | J33: =R[-1]C -> 12345.678900000001
A34: A/P | B34: =R[-1]C -> 1 | C34: =R[-1]C -> -1.2 | D34: =R[-1]C -> 12.3 | E34: =R[-1]C -> -12.34 | F34: =R[-1]C -> 123.45 | G34: =R[-1]C -> -123.456 | H34: =R[-1]C -> 1234.567 | I34: =R[-1]C -> -1234.5678 | J34: =R[-1]C -> 12345.678900000001
A35: AM/PM | B35: =R[-1]C -> 1 | C35: =R[-1]C -> -1.2 | D35: =R[-1]C -> 12.3 | E35: =R[-1]C -> -12.34 | F35: =R[-1]C -> 123.45 | G35: =R[-1]C -> -123.456 | H35: =R[-1]C -> 1234.567 | I35: =R[-1]C -> -1234.5678 | J35: =R[-1]C -> 12345.678900000001
A36: a/p | B36: =R[-1]C -> 1 | C36: =R[-1]C -> -1.2 | D36: =R[-1]C -> 12.3 | E36: =R[-1]C -> -12.34 | F36: =R[-1]C -> 123.45 | G36: =R[-1]C -> -123.456 | H36: =R[-1]C -> 1234.567 | I36: =R[-1]C -> -1234.5678 | J36: =R[-1]C -> 12345.678900000001
A37: am/pm | B37: =R[-1]C -> 1 | C37: =R[-1]C -> -1.2 | D37: =R[-1]C -> 12.3 | E37: =R[-1]C -> -12.34 | F37: =R[-1]C -> 123.45 | G37: =R[-1]C -> -123.456 | H37: =R[-1]C -> 1234.567 | I37: =R[-1]C -> -1234.5678 | J37: =R[-1]C -> 12345.678900000001
A38: [COLOR9] | B38: =R[-1]C -> 1 | C38: =R[-1]C -> 1899-12-29T19:12:00.000 | D38: =R[-1]C -> 1900-01-12T07:12:00.000 | E38: =R[-1]C -> 1899-12-18T15:50:24.000 | F38: =R[-1]C -> 1900-05-02T10:48:00.000 | G38: =R[-1]C -> 1899-08-29T13:03:21.600 | H38: =R[-1]C -> 1903-05-18T13:36:28.800 | I38: =R[-1]C -> 1896-08-13T10:22:22.080 | J38: =R[-1]C -> 1933-10-18T16:17:36.960