Sheet: Sheet1
A1: 1 | B1: =RC[-1]+1 -> 2 | C1: =RC[-1]+1 -> 3 | D1: =RC[-1]+1 -> 4 | E1: =RC[-1]+1 -> 5 | F1: =RC[-1]+1 -> 6 | G1: =RC[-1]+1 -> 7 | H1: =RC[-1]+1 -> 8 | I1: =RC[-1]+1 -> 9 | J1: =RC[-1]+1 -> 10
A2: 2 | B2: =RC[-1]+1 -> 3 | C2: =RC[-1]+1 -> 4 | D2: =RC[-1]+1 -> 5 | E2: =RC[-1]+1 -> 6 | F2: =RC[-1]+1 -> 7 | G2: =RC[-1]+1 -> 8 | H2: =RC[-1]+1 -> 9 | I2: =RC[-1]+1 -> 10 | J2: =RC[-1]+1 -> 11
A3: 3 | B3: =RC[-1]+1 -> 4 | C3: =RC[-1]+1 -> 5 | D3: =RC[-1]+1 -> 6 | E3: =RC[-1]+1 -> 7 | F3: =RC[-1]+1 -> 8 | G3: =RC[-1]+1 -> 9 | H3: =RC[-1]+1 -> 10 | I3: =RC[-1]+1 -> 11 | J3: =RC[-1]+1 -> 12
A4: 4 | B4: =RC[-1]+1 -> 5 | C4: =RC[-1]+1 -> 6 | D4: =RC[-1]+1 -> 7 | E4: =RC[-1]+1 -> 8 | F4: =RC[-1]+1 -> 9 | G4: =RC[-1]+1 -> 10 | H4: =RC[-1]+1 -> 11 | I4: =RC[-1]+1 -> 12 | J4: =RC[-1]+1 -> 13
A5: 5 | B5: =RC[-1]+1 -> 6 | C5: =RC[-1]+1 -> 7 | D5: =RC[-1]+1 -> 8 | E5: =RC[-1]+1 -> 9 | F5: =RC[-1]+1 -> 10 | G5: =RC[-1]+1 -> 11 | H5: =RC[-1]+1 -> 12 | I5: =RC[-1]+1 -> 13 | J5: =RC[-1]+1 -> 14
A6: 6 | B6: =RC[-1]+1 -> 7 | C6: =RC[-1]+1 -> 8 | D6: =RC[-1]+1 -> 9 | E6: =RC[-1]+1 -> 10 | F6: =RC[-1]+1 -> 11 | G6: =RC[-1]+1 -> 12 | H6: =RC[-1]+1 -> 13 | I6: =RC[-1]+1 -> 14 | J6: =RC[-1]+1 -> 15
A7: 7 | B7: =RC[-1]+1 -> 8 | C7: =RC[-1]+1 -> 9 | D7: =RC[-1]+1 -> 10 | E7: =RC[-1]+1 -> 11 | F7: =RC[-1]+1 -> 12 | G7: =RC[-1]+1 -> 13 | H7: =RC[-1]+1 -> 14 | I7: =RC[-1]+1 -> 15 | J7: =RC[-1]+1 -> 16
A8: 8 | B8: =RC[-1]+1 -> 9 | C8: =RC[-1]+1 -> 10 | D8: =RC[-1]+1 -> 11 | E8: =RC[-1]+1 -> 12 | F8: =RC[-1]+1 -> 13 | G8: =RC[-1]+1 -> 14 | H8: =RC[-1]+1 -> 15 | I8: =RC[-1]+1 -> 16 | J8: =RC[-1]+1 -> 17
A9: 9 | B9: =RC[-1]+1 -> 10 | C9: =RC[-1]+1 -> 11 | D9: =RC[-1]+1 -> 12 | E9: =RC[-1]+1 -> 13 | F9: =RC[-1]+1 -> 14 | G9: =RC[-1]+1 -> 15 | H9: =RC[-1]+1 -> 16 | I9: =RC[-1]+1 -> 17 | J9: =RC[-1]+1 -> 18
A10: 10 | B10: =RC[-1]+1 -> 11 | C10: =RC[-1]+1 -> 12 | D10: =RC[-1]+1 -> 13 | E10: =RC[-1]+1 -> 14 | F10: =RC[-1]+1 -> 15 | G10: =RC[-1]+1 -> 16 | H10: =RC[-1]+1 -> 17 | I10: =RC[-1]+1 -> 18 | J10: =RC[-1]+1 -> 19