Sheet: Sheet1
A1: 1 | B1: =RC[-1]:R[4]C[-1] -> 1 | C1: =RC[-2] -> 1 | D1: =RC[-3] -> 1
A2: 2 | B2: 2 | C2: =RC[-2] -> 2 | D2: =RC[-3] -> 2
A3: 3 | B3: 3 | C3: =RC[-2] -> 3 | D3: =RC[-3] -> 3
A4: 4 | B4: 4 | C4: =RC[-2] -> 4 | D4: =RC[-3] -> 4
A5: 5 | B5: 5 | C5: =RC[-2] -> 5 | D5: =RC[-3] -> 5
A6: =SUM(R[-5]C:R[-1]C*R[-5]C[1]:R[-1]C[1]) -> #VALUE! | B6: =SUM(R[-5]C[-1]:R[-1]C[-1]*R[-5]C:R[-1]C) -> 55 | C6: =RC[-2] -> #VALUE! | D6: =RC[-2] -> 55