Sheet: Database
A1: Database
A2: DAVERAGE | B2: =DAVERAGE(R[22]C[-1]:R[28]C[3],RC[2],R[17]C[-1]:R[19]C[1]) -> 11.666666666666666 | D2: 3
A3: DCOUNT | B3: =DCOUNT(R[21]C[-1]:R[27]C[3],R[-1]C[2],R[16]C[-1]:R[18]C[1]) -> 3
A4: DCOUNTA | B4: =DCOUNTA(R[20]C[-1]:R[26]C[3],R[-2]C[2],R[15]C[-1]:R[17]C[1]) -> 3
A5: DGET | B5: =DGET(R[19]C[-1]:R[25]C[3],R[-3]C[2],R[14]C[-1]:R[15]C[1]) -> 15
A6: DMAX | B6: =DMAX(R[18]C[-1]:R[24]C[3],R[-4]C[2],R[13]C[-1]:R[15]C[1]) -> 15
A7: DMIN | B7: =DMIN(R[17]C[-1]:R[23]C[3],R[-5]C[2],R[12]C[-1]:R[14]C[1]) -> 8
A8: DPRODUCT | B8: =DPRODUCT(R[16]C[-1]:R[22]C[3],R[-6]C[2],R[11]C[-1]:R[13]C[1]) -> 1440
A9: DSTDEV | B9: =DSTDEV(R[15]C[-1]:R[21]C[3],R[-7]C[2],R[10]C[-1]:R[12]C[-1]) -> 5.0579969684978394
A10: DSTDEVP | B10: =DSTDEVP(R[14]C[-1]:R[20]C[3],R[-8]C[2],R[9]C[-1]:R[11]C[-1]) -> 4.3803538669838078
A11: DSUM | B11: =DSUM(R[13]C[-1]:R[19]C[3],R[-9]C[2],R[8]C[-1]:R[10]C[1]) -> 35 | D11: =RC[-2]-R[-9]C[-2]*R[-8]C[-2] -> 0
A12: DVAR | B12: =DVAR(R[12]C[-1]:R[18]C[3],R[-10]C[2],R[7]C[-1]:R[9]C[1]) -> 12.333333333333343
A13: DVARP | B13: =DVARP(R[11]C[-1]:R[17]C[3],R[-11]C[2],R[6]C[-1]:R[8]C[1]) -> 8.2222222222222214
A15: Pivot Table
A16: GETPIVOTDATA | B16: =GETPIVOTDATA("Sum of Qux",R[16]C) -> 57
A18: Conditions
A19: Foo | B19: Bar | C19: Bar
A20: V8 | B20: >10 | C20: <16
A21: SM
A23: Data
A24: Foo | B24: Bar | C24: Baz | D24: Qux | E24: Sna
A25: V8 | B25: 18 | C25: 20 | D25: 14 | E25: 105
A26: SM | B26: 12 | C26: 12 | D26: 10 | E26: 96
A27: Nitro | B27: 13 | C27: 14 | D27: 9 | E27: 105
A28: V8 | B28: 14 | C28: 15 | D28: 10 | E28: 75
A29: SM | B29: 9 | C29: 8 | D29: 8 | E29: 76.8
A30: V* | B30: 8 | C30: 9 | D30: 6 | E30: 45
B32: Sum of Qux | C32: Column Labels
C33: 8 | D33: 8 Total | E33: 9 | F33: 9 Total | G33: 12 | H33: 12 Total | I33: 13 | J33: 13 Total | K33: 14 | L33: 14 Total | M33: 18 | N33: 18 Total | O33: Grand Total
B34: Row Labels | C34: 45 | E34: 76.8 | G34: 96 | I34: 105 | K34: 75 | M34: 105
B35: Nitro | I35: 9 | J35: 9 | O35: 9
B36: 14 | I36: 9 | J36: 9 | O36: 9
B37: SM | E37: 8 | F37: 8 | G37: 10 | H37: 10 | O37: 18
B38: 8 | E38: 8 | F38: 8 | O38: 8
B39: 12 | G39: 10 | H39: 10 | O39: 10
B40: V* | C40: 6 | D40: 6 | O40: 6
B41: 9 | C41: 6 | D41: 6 | O41: 6
B42: V8 | K42: 10 | L42: 10 | M42: 14 | N42: 14 | O42: 24
B43: 15 | K43: 10 | L43: 10 | O43: 10
B44: 20 | M44: 14 | N44: 14 | O44: 14
B45: Grand Total | C45: 6 | D45: 6 | E45: 8 | F45: 8 | G45: 10 | H45: 10 | I45: 9 | J45: 9 | K45: 10 | L45: 10 | M45: 14 | N45: 14 | O45: 57

Sheet: Date
A1: Core
A2: DATE | B2: =DATE(RC[1],RC[2],RC[3]) -> 2013-06-09T00:00:00.000 | C2: 2013 | D2: 6 | E2: 9
A3: DATEVALUE | B3: =DATEVALUE(RC[1]) -> 25363 | C3: June 9, 1969
A4: TIME | B4: =TIME(RC[1],RC[2],RC[3]) -> 1899-12-31T06:09:23.000 | C4: 6 | D4: 9 | E4: 23
A5: TIMEVALUE | B5: =TIMEVALUE(RC[1]) -> 0.97482638888888884 | C5: 11:23:45 PM
A6: NOW | B6: =NOW() -> 2014-02-20T18:46:08.730
A7: TODAY | B7: =TODAY() -> 2014-02-20T00:00:00.000
A9: Field Extraction
A10: YEAR | B10: =YEAR(R[-8]C) -> 2013
A11: MONTH | B11: =MONTH(R[-9]C) -> 6
A12: DAY | B12: =DAY(R[-10]C) -> 9
A13: HOUR | B13: =HOUR(R[-9]C) -> 6
A14: MINUTE | B14: =MINUTE(R[-10]C) -> 9
A15: SECOND | B15: =SECOND(R[-11]C) -> 23
A16: WEEKDAY | B16: =WEEKDAY(R[-14]C) -> 1
A17: WEEKNUM | B17: =WEEKNUM(R[-15]C) -> 24
A19: Relative
A20: DATEDIF | B20: =DATEDIF(RC[1],RC[2],RC[3]) -> 395 | C20: =R[-18]C[-1] -> 2013-06-09T00:00:00.000 | D20: 2014-07-09T00:00:00.000 | E20: D
A21: DAYS360 | B21: =DAYS360(R[-1]C[1],R[-1]C[2]) -> 390
A22: EDATE | B22: =EDATE(R[-20]C,RC[1]) -> 41526 | C22: 3
A23: EOMONTH | B23: =EOMONTH(R[-21]C,RC[1]) -> 41547 | C23: 3
A24: NETWORKDAYS | B24: =NETWORKDAYS(R[-4]C[1],R[-4]C[2]) -> 283
A25: NETWORKDAYS.INTL | B25: =NETWORKDAYS.INTL(R[-5]C[1],R[-5]C[2],RC[1]) -> 340 | C25: 17
A26: WORKDAY | B26: =WORKDAY(R[-6]C[1],RC[1]) -> 41605 | C26: 123
A27: WORKDAY.INTL | B27: =WORKDAY.INTL(R[-7]C[1],123,17) -> 41577
A28: YEARFRAC | B28: =YEARFRAC(R[-8]C[1],R[-8]C[2]) -> 1.0833333333333333

Sheet: Engineering
A1: Bessel | C1: * FACTDOUBLE moved to Math
A2: BESSELI | B2: =BESSELI(RC[1],RC[2]) -> 0.21273995970273565 | C2: 2 | D2: 3 | E2: =BESSELI(-1,-1) -> #NUM!
A3: BESSELJ | B3: =BESSELJ(RC[1],RC[2]) -> 0.12894324997562717 | C3: 2 | D3: 3
A4: BESSELK | B4: =BESSELK(RC[1],RC[2]) -> 0.6473854 | C4: 2 | D4: 3
A5: BESSELY | B5: =BESSELY(RC[1],RC[2]) -> -1.1277837651220644 | C5: 2 | D5: 3
A7: Error Function
A8: ERF | B8: =BESSELI(RC[1],RC[2]) -> 1
A9: ERF.PRECISE | B9: =BESSELI(RC[1],RC[2]) -> 1
A10: ERFC | B10: =BESSELI(RC[1],RC[2]) -> 1
A11: ERFC.PRECISE | B11: =BESSELI(RC[1],RC[2]) -> 1
A13: Conversion
A14: CONVERT | B14: =CONVERT(RC[1],RC[2],RC[3]) -> -273.14999999999998 | C14: 0 | D14: K | E14: C
A15: BIN2DEC | B15: =BIN2DEC(10) -> 2
A16: BIN2HEX | B16: =BIN2HEX(10) -> 2
A17: BIN2OCT | B17: =BIN2OCT(10) -> 2
A18: DEC2BIN | B18: =DEC2BIN(10) -> 1010
A19: DEC2HEX | B19: =DEC2HEX(10) -> A
A20: DEC2OCT | B20: =DEC2OCT(10) -> 12
A21: OCT2BIN | B21: =OCT2BIN(10) -> 1000
A22: OCT2DEC | B22: =OCT2DEC(10) -> 8
A23: OCT2HEX | B23: =OCT2HEX(10) -> 8
A24: HEX2BIN | B24: =HEX2BIN(10) -> 10000
A25: HEX2DEC | B25: =HEX2DEC(10) -> 16
A26: HEX2OCT | B26: =HEX2OCT(10) -> 20
A28: Dirac and Heaviside
A29: DELTA | B29: =DELTA(5) -> 0
A30: GESTEP | B30: =GESTEP(5) -> 1
A32: Complex
A33: COMPLEX | B33: =COMPLEX(2,3) -> 2+3i | C33: =COMPLEX(2,3,"j") -> 2+3j
A34: IMABS | B34: =IMABS(RC[1]) -> 3.6055512754639896 | C34: =COMPLEX(2,3,"j") -> 2+3j
A35: IMAGINARY | B35: =IMAGINARY(RC[1]) -> 3 | C35: =COMPLEX(2,3,"j") -> 2+3j
A36: IMARGUMENT | B36: =IMARGUMENT(RC[1]) -> 0.98279372324732905 | C36: =COMPLEX(2,3,"j") -> 2+3j
A37: IMCONJUGATE | B37: =IMCONJUGATE(RC[1]) -> 2-3j | C37: =COMPLEX(2,3,"j") -> 2+3j
A38: IMCOS | B38: =IMCOS(RC[1]) -> -4.18962569096881-9.10922789375534j | C38: =COMPLEX(2,3,"j") -> 2+3j
A39: IMDIV | B39: =IMDIV(R[4]C,R[3]C) -> 3.32192809488737-8.28846662730513E-15j | C39: =COMPLEX(2,3,"j") -> 2+3j
A40: IMEXP | B40: =IMEXP(RC[1]) -> -7.3151100949011+1.0427436562359j | C40: =COMPLEX(2,3,"j") -> 2+3j
A41: IMLN | B41: =IMLN(RC[1]) -> 1.28247467873077+0.982793723247329j | C41: =COMPLEX(2,3,"j") -> 2+3j
A42: IMLOG10 | B42: =IMLOG10(RC[1]) -> 0.556971676153418+0.426821890855467j | C42: =COMPLEX(2,3,"j") -> 2+3j
A43: IMLOG2 | B43: =IMLOG2(RC[1]) -> 1.85021985907055+1.41787163074572j | C43: =COMPLEX(2,3,"j") -> 2+3j
A44: IMPOWER | B44: =IMPOWER(RC[1],2) -> -5+12j | C44: =COMPLEX(2,3,"j") -> 2+3j
A45: IMPRODUCT | B45: =IMPRODUCT(RC[1],RC[2]) -> -10+24j | C45: =COMPLEX(2,3,"j") -> 2+3j | D45: =COMPLEX(4,6,"j") -> 4+6j
A46: IMREAL | B46: =IMREAL(RC[1]) -> 2 | C46: =COMPLEX(2,3,"j") -> 2+3j
A47: IMSIN | B47: =IMSIN(RC[1]) -> 9.15449914691143-4.16890695996656j | C47: =COMPLEX(2,3,"j") -> 2+3j
A48: IMSQRT | B48: =IMSQRT(RC[1]) -> 1.67414922803554+0.895977476129838j | C48: =COMPLEX(2,3,"j") -> 2+3j
A49: IMSUB | B49: =IMSUB(RC[1],RC[2]) -> -2-2j | C49: =COMPLEX(2,3,"j") -> 2+3j | D49: =COMPLEX(4,5,"j") -> 4+5j
A50: IMSUM | B50: =IMSUM(R[-17]C[1]:RC[2]) -> 48+70j | C50: =COMPLEX(2,3,"j") -> 2+3j | D50: =COMPLEX(4,5,"j") -> 4+5j

Sheet: Finance
A1: Conversion
A2: DOLLARDE | B2: =DOLLARDE(RC[2],RC[3]) -> 1.125 | D2: 1.02 | E2: 16
A3: DOLLARFR | B3: =DOLLARFR(R[-1]C,R[-1]C[3]) -> 1.02
A4: EFFECT | B4: =EFFECT(RC[2],RC[3]) -> 5.3542667370758412E-2 | D4: 5.2499999999999998E-2 | E4: 4
A5: NOMINAL | B5: =NOMINAL(R[-1]C,R[-1]C[3]) -> 5.2500000000000213E-2
A7: Cash Flows
A8: IRR | B8: =IRR(RC[2]:RC[7],0.1) -> 8.663094803652216E-2 | D8: -70000 | E8: 12000 | F8: 15000 | G8: 18000 | H8: 21000 | I8: 26000
A9: MIRR | B9: =MIRR(RC[2]:RC[7],RC[8],RC[9]) -> 0.12609413036590511 | D9: -120000 | E9: 39000 | F9: 30000 | G9: 21000 | H9: 37000 | I9: 46000 | J9: 0.1 | K9: 0.12
A10: NPV | B10: =NPV(RC[2],RC[3],RC[4],RC[5],RC[6]) -> 1188.4434123352207 | D10: 0.1 | E10: -10000 | F10: 3000 | G10: 4200 | H10: 6800
A11: XIRR | B11: =XIRR(R[-1]C[3]:R[-1]C[6],RC[3]:RC[6]) -> 5.3152377605438241 | E11: 2013-01-01T00:00:00.000 | F11: 2013-02-01T00:00:00.000 | G11: 2013-03-01T00:00:00.000 | H11: 2013-04-01T00:00:00.000
A12: XNPV | B12: =XNPV(R[-1]C,R[-2]C[3]:R[-2]C[6],R[-1]C[3]:R[-1]C[6]) -> -6.2115468608681113E-6
A13: FVSCHEDULE | B13: =FVSCHEDULE(1,{0.09,0.11,0.1}) -> 1.3308900000000004 | C13: =FVSCHEDULE(1,RC[1]:RC[3]) -> 1.3308900000000004 | D13: 0.09 | E13: 0.11 | F13: 0.1
A15: Annuities | D15: rate | E15: nper | F15: pmt | G15: pv
A16: FV | B16: =FV(RC[2]/12,RC[3],RC[4],RC[5],1) -> 2581.4033740601185 | D16: 0.06 | E16: 10 | F16: -200 | G16: -500
A17: IPMT | B17: =IPMT(RC[2]/12,3,RC[3],RC[5]) -> -22.406893015924034 | D17: 0.1 | E17: 3 | G17: 8000
A18: ISPMT | B18: =ISPMT(RC[2]/12,1,RC[3]*12,RC[5]) -> -64.814814814814824 | D18: 0.1 | E18: 3 | G18: 8000
A19: NPER | B19: =NPER(RC[2]/12,RC[4],RC[5]) -> -9.5785940398131615 | D19: 0.12 | F19: -100 | G19: -1000
A20: PMT | B20: =PMT(R[-3]C[2]/12,R[-3]C[3],R[-3]C[5]) -> -2711.2340549268079
A21: PPMT | B21: =PPMT(R[-4]C[2]/12,3,R[-4]C[3],R[-4]C[5]) -> -2688.8271619108841
A22: PV | B22: =PV(RC[2]/12,12*RC[3],RC[4]) -> -59777.145851187823 | D22: 0.08 | E22: 20 | F22: 500
A23: RATE | B23: =RATE(RC[3]*12,RC[4],RC[5])*12 -> 9.2417669858416415E-2 | E23: 4 | F23: -200 | G23: 8000
A24: CUMIPMT | B24: =CUMIPMT(RC[2]/12,RC[3]*12,RC[4],RC[5],RC[6],0) -> -11135.232130750841 | D24: 0.09 | E24: 30 | F24: 125000 | G24: 13 | H24: 24
A25: CUMPRINC | B25: =CUMPRINC(R[-1]C[2]/12,R[-1]C[3]*12,R[-1]C[4],R[-1]C[5],R[-1]C[6],0) -> -934.10712342089789
A27: Securities | D27: settlement | E27: maturity | F27: discount | G27: pr | H27: redemption
A28: TBILLEQ | B28: =TBILLEQ(R[1]C[2],R[1]C[3],RC[4]) -> 9.4151493565943017E-2 | F28: 9.1399999999999995E-2
A29: TBILLPRICE | B29: =TBILLPRICE(RC[2],RC[3],RC[4]) -> 98.45 | D29: 2008-03-31T00:00:00.000 | E29: 2008-06-01T00:00:00.000 | F29: 0.09 | G29: 98.45
A30: TBILLYIELD | B30: =TBILLYIELD(R[-1]C[2],R[-1]C[3],R[-1]C[5]) -> 9.141696292534264E-2
A31: PRICE | B31: =PRICE(RC[2],RC[3],RC[4],RC[5],RC[6],RC[7]) -> 94.634361621322128 | D31: 2008-02-15T00:00:00.000 | E31: 2017-11-15T00:00:00.000 | F31: 5.7500000000000002E-2 | G31: 6.5000000000000002E-2 | H31: 100 | I31: 2
A32: YIELD | B32: =YIELD(RC[2],RC[3],RC[4],RC[5],RC[6],RC[7]) -> 6.5000006880731431E-2 | D32: 2008-02-15T00:00:00.000 | E32: 2016-11-15T00:00:00.000 | F32: 5.7500000000000002E-2 | G32: 95.042869999999994 | H32: 100 | I32: 2
A33: DISC | B33: =DISC(RC[2],RC[3],RC[5],RC[6]) -> 5.2071428571428838E-2 | D33: 2007-01-25T00:00:00.000 | E33: 2007-06-15T00:00:00.000 | G33: 97.974999999999994 | H33: 100
A34: PRICEDISC | B34: =PRICEDISC(RC[2],RC[3],RC[4],RC[6],SQRT(4)) -> 99.795833333333334 | D34: 2008-02-16T00:00:00.000 | E34: 2008-03-01T00:00:00.000 | F34: 5.2499999999999998E-2 | H34: 100
A35: YIELDDISC | B35: =YIELDDISC(R[-1]C[2],R[-1]C[3],RC[5],R[-1]C[6],LOG(100)/LOG(10)) -> 5.2822571986858337E-2 | G35: 99.795000000000002
A36: PRICEMAT | B36: =PRICEMAT(RC[2],RC[3],RC[4],RC[5],RC[5],RC[6]) -> 99.984498875556937 | D36: 2008-02-15T00:00:00.000 | E36: 2008-04-13T00:00:00.000 | F36: 2007-11-11T00:00:00.000 | G36: 6.0999999999999999E-2 | H36: 1899-12-31T00:00:00.000
A37: YIELDMAT | B37: =YIELDMAT(RC[2],RC[3],RC[4],RC[5],RC[6],RC[7]) -> 6.0954333691538673E-2 | D37: 2008-03-15T00:00:00.000 | E37: 2008-11-03T00:00:00.000 | F37: 2007-11-08T00:00:00.000 | G37: 6.25E-2 | H37: 100.0123 | I37: 0
A38: DURATION | B38: =DURATION(RC[2],RC[3],RC[4],RC[5],RC[6],RC[7]) -> 5.9937749555451862 | D38: 2008-01-01T00:00:00.000 | E38: 2016-01-01T00:00:00.000 | F38: 0.08 | G38: 0.09 | H38: 2 | I38: 1
A39: MDURATION | B39: =MDURATION(R[-1]C[2],R[-1]C[3],R[-1]C[4],R[-1]C[5],R[-1]C[6],R[-1]C[7]) -> 5.7356698139188387
A40: ACCRINT | B40: =ACCRINT(RC[2],RC[3],RC[4],RC[5],RC[6],RC[7],RC[8]) -> 16.666666666666664 | D40: 2008-03-01T00:00:00.000 | E40: 2008-08-31T00:00:00.000 | F40: 2008-05-01T00:00:00.000 | G40: 0.1 | H40: 1000 | I40: 2 | J40: 0
A41: ACCRINTM | B41: =ACCRINTM(RC[2],RC[3],RC[5],RC[6],RC[7]) -> 20.547945205479451 | D41: 2008-04-01T00:00:00.000 | E41: 2008-06-15T00:00:00.000 | G41: 0.1 | H41: 1000 | I41: 3
A42: INTRATE | B42: =INTRATE(RC[2],RC[3],RC[4],RC[5],RC[6]) -> 5.7680000000000002E-2 | D42: 2008-02-15T00:00:00.000 | E42: 2008-05-15T00:00:00.000 | F42: 1000000 | G42: 1014420 | H42: 2
A43: RECEIVED | B43: =RECEIVED(RC[2],RC[3],RC[4],RC[5],RC[6]) -> 1014584.6544071021 | D43: 2008-02-15T00:00:00.000 | E43: 2008-05-15T00:00:00.000 | F43: 1000000 | G43: 5.7500000000000002E-2 | H43: 2
A44: ODDFPRICE | B44: =ODDFPRICE(RC[2],RC[3],RC[4],RC[5],RC[6],RC[7],RC[8],RC[9],RC[10]) -> 113.59771747407883 | D44: 2008-11-11T00:00:00.000 | E44: 2021-03-01T00:00:00.000 | F44: 2008-10-15T00:00:00.000 | G44: 2009-03-01T00:00:00.000 | H44: 7.85E-2 | I44: 6.25E-2 | J44: 100 | K44: 2 | L44: 1
A45: ODDFYIELD | B45: =ODDFYIELD(RC[2],RC[3],RC[4],RC[5],RC[6],RC[7],RC[8],RC[9],RC[10]) -> 7.7245541597298878E-2 | D45: 2008-11-11T00:00:00.000 | E45: 2021-03-01T00:00:00.000 | F45: 2008-10-15T00:00:00.000 | G45: 2009-03-01T00:00:00.000 | H45: 5.7500000000000002E-2 | I45: 84.5 | J45: 100 | K45: 2 | L45: 0
A46: ODDLPRICE | B46: =ODDLPRICE(RC[2],RC[3],RC[4],RC[5],RC[6],RC[7],RC[8],RC[9]) -> 110.88286909824446 | D46: 2008-11-11T00:00:00.000 | E46: 2021-03-01T00:00:00.000 | F46: 2008-10-15T00:00:00.000 | G46: 7.85E-2 | H46: 6.25E-2 | I46: 100 | J46: 2 | K46: 0
A47: ODDLYIELD | B47: =ODDLYIELD(RC[2],RC[3],RC[4],RC[5],RC[6],RC[7],RC[8],RC[9]) -> 8.2548086314953334E-2 | D47: 2008-11-11T00:00:00.000 | E47: 2021-03-01T00:00:00.000 | F47: 2008-10-15T00:00:00.000 | G47: 5.7500000000000002E-2 | H47: 84.5 | I47: 100 | J47: 2 | K47: 0
A48: COUPDAYBS | B48: =COUPDAYBS(RC[2],RC[3],RC[4],RC[5]) -> 71 | D48: =DATE(2007,1,25) -> 2007-01-25T00:00:00.000 | E48: =DATE(2008,11,15) -> 2008-11-15T00:00:00.000 | F48: 2 | G48: 1
A49: COUPDAYS | B49: =COUPDAYS(R[-1]C[2],R[-1]C[3],R[-1]C[4],R[-1]C[5]) -> 181
A50: COUPDAYSNC | B50: =COUPDAYSNC(R[-2]C[2],R[-2]C[3],R[-2]C[4],R[-2]C[5]) -> 110
A51: COUPNCD | B51: =COUPNCD(R[-3]C[2],R[-3]C[3],R[-3]C[4],R[-3]C[5]) -> 2007-05-15T00:00:00.000
A52: COUPNUM | B52: =COUPNUM(R[-4]C[2],R[-4]C[3],R[-4]C[4],R[-4]C[5]) -> 4
A53: COUPPCD | B53: =COUPPCD(R[-5]C[2],R[-5]C[3],R[-5]C[4],R[-5]C[5]) -> 39036
A55: Depreciation | D55: cost | E55: salvage | F55: life | G55: period
A56: DB | B56: =DB(RC[2],RC[3],RC[4],RC[5],RC[6]) -> 55841.756736028445 | D56: 1000000 | E56: 100000 | F56: 6 | G56: 6 | H56: 7
A57: DDB | B57: =DDB(RC[2],RC[3],RC[4]*365,RC[5]) -> 1.3143479076749858 | D57: 2400 | E57: 300 | F57: 10 | G57: 2
A58: SLN | B58: =SLN(R[1]C[2],R[1]C[3],R[1]C[4]) -> 2250
A59: SYD | B59: =SYD(RC[2],RC[3],RC[4],RC[5]) -> 409.09090909090907 | D59: 30000 | E59: 7500 | F59: 10 | G59: 10
A60: VDB | B60: =VDB(R[-3]C[2],R[-3]C[3],R[-3]C[4]*365,5,9) -> 5.2415679423312396 | D60: cost | E60: salvage | F60: rate | G60: period | H60: datepurc | I60: datefirst
A61: AMORDEGRC | B61: =AMORDEGRC(R[1]C[2],R[1]C[6],R[1]C[7],R[1]C[3],R[1]C[5],R[1]C[4]) -> 767
A62: AMORLINC | B62: =AMORLINC(RC[2],RC[6],RC[7],RC[3],RC[5],RC[4]) -> 360 | D62: 2400 | E62: 300 | F62: 0.15 | G62: 1 | H62: 2008-08-09T00:00:00.000 | I62: 2008-12-31T00:00:00.000

Sheet: Information
A1: CELL | B1: =CELL(RC[1],RC[2]) -> $D$1 | C1: address
A2: ERROR.TYPE | B2: =ERROR.TYPE(#VALUE!) -> 3 | C2: =0/0 -> #DIV/0!
A3: INFO | B3: =INFO(RC[1]) -> 15.0 | C3: release
A4: ISBLANK | B4: =ISBLANK(RC[1]) -> 1
A5: ISERR | B5: =ISERR(RC[1]) -> 0
A6: ISERROR | B6: =ISERROR(R[-4]C[1]) -> 1
A7: ISEVEN | B7: =ISEVEN(RC[1]) -> 0 | C7: 7
A8: ISLOGICAL | B8: =ISLOGICAL(RC[1]) -> 1 | C8: 1
A9: ISNA | B9: =ISNA(RC[1]) -> 1 | C9: =NA() -> #N/A
A10: ISNONTEXT | B10: =ISNONTEXT(RC[1]) -> 1 | C10: 3
A11: ISNUMBER | B11: =ISNUMBER(RC[1]) -> 0 | C11: 3
A12: ISODD | B12: =ISODD(RC[1]) -> 1 | C12: 3
A13: ISREF | B13: =ISREF("address") -> 0 | C13: A5
A14: ISTEXT | B14: =ISTEXT(RC[1]) -> 0 | C14: 3
A15: N | B15: =N(RC[1]) -> 1 | C15: 1
A16: NA | B16: =NA() -> #N/A
A17: TYPE | B17: =TYPE({1,2;3,4}) -> 64

Sheet: Logical
A1: Singletons
A2: FALSE | B2: =FALSE() -> 0
A3: TRUE | B3: =TRUE() -> 1
A5: Operators
A6: AND | B6: =AND(RC[1],RC[2]) -> 0 | C6: 1 | D6: 0
A7: NOT | B7: =NOT(R[-1]C[1]) -> 0
A8: OR | B8: =OR(R[-2]C[1],R[-2]C[2]) -> 1
A10: Conditionals
A11: IF | B11: =IF(R[-3]C,RC[1],RC[2]) -> 123 | C11: 123 | D11: 456
A12: IFERROR | B12: =IFERROR(RC[1],RC[2]) -> 456 | C12: =0/0 -> #DIV/0! | D12: 456

Sheet: Lookup
A1: Reference Info
A2: COLUMN | B2: =COLUMN(RC[1]) -> 3
A3: ROW | B3: =ROW(RC[1]) -> 3
A4: COLUMNS | B4: =COLUMNS(R[6]C[-1]:R[17]C[2]) -> 4
A5: ROWS | B5: =ROWS(R[5]C[-1]:R[16]C[2]) -> 12
A6: INDIRECT | B6: =INDIRECT(RC[1]) -> ADDRESS | C6: A10
A7: AREAS | B7: =AREAS((RC:R[7]C[2],R[-5]C[3],R[-3]C[4]:R[9]C[6])) -> 3
A9: Relative
A10: ADDRESS | B10: =ADDRESS(2,2) -> $B$2
A11: OFFSET | B11: =OFFSET(RC[1],RC[2],RC[3]) -> 0 | C11: C14 | D11: -1 | E11: 0
A13: Lookup
A14: CHOOSE | B14: =CHOOSE(RC[1],R[-4]C[-1],R[-7]C[-1],RC[-1],#REF!,R[-12]C[-1],R[-10]C[-1],R[1]C[-1],R[9]C[-1],R[2]C[-1],R[3]C[-1]) -> CHOOSE | C14: 3
A15: HLOOKUP | B15: =HLOOKUP(RC[1],R[-5]C[-1]:R[6]C[1],10,FALSE) -> LOOKUP (arr) | C15: ADDRESS
A16: INDEX (ref) | B16: =INDEX(R[-15]C[-1]:R[5]C[2],RC[1],RC[2]) -> ADDRESS | C16: 6 | D16: 2
A17: INDEX (arr) | B17: =INDEX({1,2;3,4},RC[1],RC[2]) -> 3 | C17: 2 | D17: 1
A18: LOOKUP (ref) | B18: =LOOKUP(RC[1],R[-8]C[-1]:R[3]C[-1]) -> MATCH | C18: NIGGLER
A19: LOOKUP (arr) | B19: =LOOKUP(3,{1,2,2.5,4,5,6,7,8,9}) -> 2.5
A20: MATCH | B20: =MATCH(RC[1],R[-10]C[-1]:R[1]C[-1]) -> 11 | C20: NIGGLER
A21: VLOOKUP | B21: =VLOOKUP(RC[1],R[-11]C[-1]:RC[3],RC[2]) -> MATCH | C21: NIGGLER | D21: 1
A23: HYPERLINK | B23: =HYPERLINK("http://nig.gl","niggler") -> niggler
A25: Array Formula
A26: TRANSPOSE | B26: =TRANSPOSE(R[-24]C[-1]:R[-22]C[-1]) -> COLUMN | C26: ROW | D26: COLUMNS

Sheet: Math
A1: 1 | B1: 2 | C1: 3 | D1: 4 | E1: 5 | F1: 6 | G1: 7 | H1: 8 | I1: 9 | J1: 10 | K1: 11
A2: ABS | B2: =ABS(R[-1]C) -> 2 | C2: 5 | D2: 6 | E2: 7 | F2: 8
A3: ACOS | B3: =ACOS(1/R[-2]C) -> 1.0471975511965976
A4: ACOSH | B4: =ACOSH(R[-3]C) -> 1.3169578969248166
A5: AGGREGATE | B5: =AGGREGATE(R[-4]C[-1],R[-4]C,R[-4]C[1]:R[-4]C[9]) -> 7
A6: ASIN | B6: =ASIN(1/R[-5]C) -> 0.52359877559829893
A7: ASINH | B7: =ASINH(R[-6]C) -> 1.4436354751788103
A8: ATAN | B8: =ATAN(R[-7]C) -> 1.1071487177940904
A9: ATAN2 | B9: =ATAN2(R[-8]C[-1],R[-8]C) -> 1.1071487177940904
A10: ATANH | B10: =ATANH(1/R[-9]C) -> 0.54930614433405489
A11: CEILING | B11: =CEILING(R[-10]C,R[-10]C[1]) -> 3
A12: CEILING.PRECISE | B12: =CEILING.PRECISE(R[-11]C,R[-11]C[1]) -> 3
A13: COMBIN | B13: =COMBIN(R[-12]C[2],R[-12]C[1]) -> 4
A14: COS | B14: =COS(R[-13]C) -> -0.41614683654714241
A15: COSH | B15: =COSH(R[-14]C) -> 3.7621956910836314
A16: DEGREES | B16: =DEGREES(R[-15]C) -> 114.59155902616465
A17: ECMA.CEILING | B17: =ECMA.CEILING(R[-15]C,2) -> 2 | F17: * not mentioned in summary
A18: EVEN | B18: =EVEN(R[-17]C) -> 2
A19: EXP | B19: =EXP(R[-18]C) -> 7.3890560989306504
A20: FACT | B20: =FACT(R[-19]C) -> 2
A21: FACTDOUBLE | B21: =FACTDOUBLE(R[-20]C[3]) -> 15 | F21: * originally in engineering
A22: FLOOR | B22: =FLOOR(R[-21]C,R[-21]C[1]) -> 0
A23: FLOOR.PRECISE | B23: =FLOOR.PRECISE(R[-22]C,R[-22]C[1]) -> 0
A24: GAMMALN | B24: =GAMMALN(RC[1]) -> 3.1780538303479458 | C24: 5 | F24: * originally in statistical
A25: GAMMALN.PRECISE | B25: =GAMMALN.PRECISE(R[-1]C[1]) -> 3.1780538303479458 | F25: * originally in statistical
A26: GCD | B26: =GCD(R[-25]C[4],R[-25]C[8]) -> 2
A27: INT | B27: =INT(R[-26]C) -> 2
A28: ISO.CEILING | B28: =ISO.CEILING(R[-27]C[4]) -> 6
A29: LCM | B29: =LCM(R[-28]C[4],R[-28]C[7]) -> 18
A30: LN | B30: =LN(R[-29]C[7]) -> 2.1972245773362196
A31: LOG | B31: =LOG(R[-30]C[8]) -> 1
A32: LOG10 | B32: =LOG10(R[-31]C[3]) -> 0.69897000433601886
A33: MDETERM | B33: =MDETERM(R[-32]C[1]:R[-31]C[2]) -> -2.0000000000000018
A34: MINVERSE | B34: =MINVERSE(R[-33]C[1]:R[-32]C[2]) -> -2.9999999999999973
A35: MMULT | B35: =MMULT(R[-34]C[1]:R[-33]C[2],R[-34]C[3]:R[-33]C[4]) -> 43
A36: MOD | B36: =MOD(R[-34]C[3],R[-35]C[3]) -> 2
A37: MROUND | B37: =MROUND(R[-36]C[1],R[-36]C[2]) -> 4
A38: MULTINOMIAL | B38: =MULTINOMIAL(R[-37]C[8],R[-37]C[3],R[-37]C[1]) -> 2450448
A39: ODD | B39: =ODD(R[-38]C[4]) -> 7
A40: PERMUT | B40: =PERMUT(R[-38]C[4],R[-39]C[3]) -> 6720 | F40: * originally in statistical
A41: PI | B41: =PI() -> 3.1415926535897931
A42: POWER | B42: =POWER(R[-41]C[1],R[-41]C[2]) -> 81
A43: PRODUCT | B43: =PRODUCT(R[-42]C[1],R[-42]C[2],R[-42]C[3]) -> 60
A44: QUOTIENT | B44: =QUOTIENT(R[-42]C[3],R[-43]C[1]) -> 2
A45: RADIANS | B45: =RADIANS(R[-44]C[3]) -> 8.7266462599716474E-2
A46: RAND | B46: =RAND() -> 0.57152425286843112
A47: RANDBETWEEN | B47: =RANDBETWEEN(R[-46]C[2],R[-45]C[3]) -> 4
A48: ROMAN | B48: =ROMAN(R[-47]C) -> II | C48: =ROMAN(R[-47]C[-1],R[-47]C) -> II
A49: ROUND | B49: =ROUND(R[-48]C[3],R[-47]C[2]) -> 5
A50: ROUNDDOWN | B50: =ROUNDDOWN(R[-49]C[4],R[-49]C[6]) -> 6
A51: ROUNDUP | B51: =ROUNDUP(R[-50]C[1],R[-49]C) -> 3
A52: SERIESSUM | B52: =SERIESSUM(R[-51]C[1],R[-50]C[1],R[-50]C[2],R[-51]C[2]:R[-51]C[9]) -> 2.928421387459129E+23
A53: SIGN | B53: =SIGN(R[-51]C[2]) -> 1
A54: SIN | B54: =SIN(R[-53]C[3]) -> -0.95892427466313845
A55: SINH | B55: =SINH(R[-53]C[2]) -> 201.71315737027922
A56: SQRT | B56: =SQRT(R[-55]C[1]) -> 1.7320508075688772
A57: SQRTPI | B57: =SQRTPI(R[-55]C) -> 2.5066282746310002
A58: STANDARDIZE | B58: =STANDARDIZE(RC[1],RC[2],RC[3]) -> 0.2 | C58: 3 | D58: 2 | E58: 5 | F58: * originally in statistical
A59: SUBTOTAL | B59: =SUBTOTAL(R[-58]C[-1],R[-58]C,R[-58]C[1]:R[-58]C[9]) -> 6.5
A60: SUM | B60: =SUM(R[-59]C) -> 2 | C60: =SUM(R[-59]C[-1]:R[-59]C[8]) -> 65 | D60: =SUM(R[-59]C[-2]:R[-59]C[7],R[-58]C[-2]:R[-58]C[2]) -> 93
A61: SUMIF | B61: =SUMIF(R[-60]C[1]:R[-59]C[1],">3") -> 5 | C61: =SUMIF(R[-60]C:R[-59]C,">3",R[-60]C[1]:R[-59]C[1]) -> 6
A62: SUMIFS | B62: =SUMIFS(R[-61]C[1]:R[-60]C[1],R[-61]C[2]:R[-60]C[2],">0",R[-61]C[3]:R[-60]C[3],"<7") -> 3
A63: SUMPRODUCT | B63: =SUMPRODUCT(R[-62]C[1]:R[-62]C[9]) -> 63 | C63: =SUMPRODUCT(R[-62]C:R[-62]C[3],R[-61]C:R[-61]C[3]) -> 122
A64: SUMSQ | B64: =SUMSQ(R[-63]C[1],R[-62]C[2]) -> 45 | C64: =SUMSQ(R[-62]C[1],R[-63]C[2],R[-62]C[3]) -> 125
A65: SUMX2MY2 | B65: =SUMX2MY2(R[-64]C[1]:R[-64]C[4],R[-63]C[1]:R[-63]C[4]) -> -88
A66: SUMX2PY2 | B66: =SUMX2PY2(R[-65]C[1]:R[-65]C[4],R[-64]C[1]:R[-64]C[4]) -> 260
A67: SUMXMY2 | B67: =SUMXMY2(R[-66]C[1]:R[-66]C[4],R[-65]C[1]:R[-65]C[4]) -> 16
A68: TAN | B68: =TAN(R[-66]C[1]) -> -3.3805150062465859
A69: TANH | B69: =TANH(R[-68]C[1]) -> 0.99505475368673058
A70: TRUNC | B70: =TRUNC(R[-69]C[1],R[-68]C[4]) -> 3

Sheet: Statistical
A1: Distributions
A2: BETA.DIST | B2: =BETA.DIST(RC[1],RC[2],RC[3],RC[4]) -> 1.5 | C2: 0.5 | D2: 2 | E2: 2 | F2: 0
A3: BETA.INV | B3: =BETA.INV(RC[1],RC[2],RC[3]) -> 0.5 | C3: 0.5 | D3: 2 | E3: 2
A4: BETADIST | B4: =BETADIST(RC[1],RC[2],RC[3]) -> 0.5 | C4: 0.5 | D4: 2 | E4: 2
A5: BETAINV | B5: =BETAINV(RC[1],RC[2],RC[3]) -> 0.5 | C5: 0.5 | D5: 2 | E5: 2
A6: BINOM.DIST | B6: =BINOM.DIST(RC[1],RC[2],RC[3],RC[4]) -> 0.95265101260000007 | C6: 5 | D6: 10 | E6: 0.3 | F6: 1
A7: BINOM.INV | B7: =BINOM.INV(RC[1],RC[2],RC[3]) -> 7 | C7: 20 | D7: 0.5 | E7: 0.1 | F7: 1
A8: BINOMDIST | B8: =BINOMDIST(RC[1],RC[2],RC[3],RC[4]) -> 0.10291934520000003 | C8: 5 | D8: 10 | E8: 0.3 | F8: 0
A9: CHIDIST | B9: =CHIDIST(RC[1],RC[2]) -> 0.65996322969428256 | C9: 5 | D9: 7
A10: CHIINV | B10: =CHIINV(R[-1]C,R[-1]C[2]) -> 5
A11: CHISQ.DIST | B11: =CHISQ.DIST(RC[1],RC[2],RC[3]) -> 0.34003677030571738 | C11: 5 | D11: 7 | E11: 1
A12: CHISQ.DIST.RT | B12: =CHISQ.DIST.RT(R[-1]C[1],R[-1]C[2]) -> 0.65996322969428256
A13: CHISQ.INV | B13: =CHISQ.INV(R[-2]C,R[-2]C[2]) -> 5
A14: CHISQ.INV.RT | B14: =CHISQ.INV.RT(R[-2]C,R[-3]C[2]) -> 5
A15: CONFIDENCE | B15: =CONFIDENCE(RC[1],RC[2],RC[3]) -> 0.10364333894937899 | C15: 0.3 | D15: 1 | E15: 100
A16: CONFIDENCE.NORM | B16: =CONFIDENCE.NORM(RC[1],RC[2],RC[3]) -> 0.10364333894937899 | C16: 0.3 | D16: 1 | E16: 100
A17: CONFIDENCE.T | B17: =CONFIDENCE.T(RC[1],RC[2],RC[3]) -> 0.10418907592517826 | C17: 0.3 | D17: 1 | E17: 100
A18: CRITBINOM | B18: =CRITBINOM(RC[1],RC[2],RC[3]) -> 64 | C18: 120 | D18: 0.5 | E18: 0.75
A19: EXPON.DIST | B19: =EXPON.DIST(RC[1],RC[2],RC[3]) -> 0.8646647167633873 | C19: 1 | D19: 2 | E19: 1
A20: EXPONDIST | B20: =EXPONDIST(RC[1],RC[2],RC[3]) -> 0.2706705664732254 | C20: 1 | D20: 2 | E20: 0
A21: F.DIST | B21: =F.DIST(RC[1],RC[2],RC[3],RC[4]) -> 0.53524199845511 | C21: 1 | D21: 2 | E21: 3 | F21: 1
A22: F.DIST.RT | B22: =F.DIST.RT(R[-1]C[1],R[-1]C[2],R[-1]C[3]) -> 0.46475800154489
A23: F.INV | B23: =F.INV(R[-2]C,R[-2]C[2],R[-2]C[3]) -> 1.0000000000000002
A24: F.INV.RT | B24: =F.INV.RT(R[-2]C,R[-3]C[2],R[-3]C[3]) -> 1.0000000000000002
A25: FDIST | B25: =FDIST(RC[1],RC[2],RC[3]) -> 0.17355371900826444 | C25: 5 | D25: 4 | E25: 2
A26: FINV | B26: =FINV(R[-1]C,R[-1]C[2],R[-1]C[3]) -> 5.0000000000000009
A27: FISHER | B27: =FISHER(RC[1]) -> 0.54930614433405489 | C27: 0.5
A28: FISHERINV | B28: =FISHERINV(R[-1]C) -> 0.50000000000000011
A29: GAMMA.DIST | B29: =GAMMA.DIST(RC[1],RC[2],RC[3],RC[4]) -> 0.38494001106330422 | C29: 4 | D29: 2 | E29: 3 | F29: 1
A30: GAMMA.INV | B30: =GAMMA.INV(R[-1]C,R[-1]C[2],R[-1]C[3]) -> 3.9999999999999991
A31: GAMMADIST | B31: =GAMMADIST(R[-2]C[1],R[-2]C[2],R[-2]C[3],R[-2]C[4]) -> 0.38494001106330422
A32: GAMMAINV | B32: =GAMMAINV(R[-1]C,R[-3]C[2],R[-3]C[3]) -> 3.9999999999999991
A33: HYPGEOM.DIST | B33: =HYPGEOM.DIST(RC[1],RC[2],RC[3],RC[4],RC[5]) -> 0.41666666666666635 | C33: 1 | D33: 2 | E33: 7 | F33: 9 | G33: 5
A34: HYPGEOMDIST | B34: =HYPGEOMDIST(RC[1],RC[2],RC[3],RC[4]) -> 0.5357142857142857 | C34: 2 | D34: 3 | E34: 6 | F34: 8
A35: LOGINV | B35: =LOGINV(RC[1],RC[2],RC[3]) -> 148.4131591025766 | C35: 0.5 | D35: 5 | E35: 5
A36: LOGNORM.DIST | B36: =LOGNORM.DIST(RC[1],RC[2],RC[3],RC[4]) -> 0.34457825838967576 | C36: 1 | D36: 2 | E36: 5 | F36: 1
A37: LOGNORM.INV | B37: =LOGNORM.INV(R[-1]C,R[-1]C[2],R[-1]C[3]) -> 0.99999999999999867
A38: LOGNORMDIST | B38: =LOGNORMDIST(R[-2]C[1],R[-2]C[2],R[-2]C[3]) -> 0.34457825838967576
A39: NEGBINOM.DIST | B39: =NEGBINOM.DIST(RC[1],RC[2],RC[3],RC[4]) -> 3.860084305800001E-2 | C39: 5 | D39: 7 | E39: 0.3 | F39: 1
A40: NEGBINOMDIST | B40: =NEGBINOMDIST(R[-1]C[1],R[-1]C[2],R[-1]C[3]) -> 1.6981691958000006E-2 | C40: 5 | D40: 7 | E40: 0.3
A41: NORM.DIST | B41: =NORM.DIST(RC[1],RC[2],RC[3],RC[4]) -> 0.63055865981823644 | C41: 0 | D41: -1 | E41: 3 | F41: 1
A42: NORM.INV | B42: =NORM.INV(R[-1]C,R[-1]C[2],R[-1]C[3]) -> 8.8817841970012523E-16
A43: NORM.S.DIST | B43: =NORM.S.DIST(RC[1],RC[2]) -> 0.9986501019683699 | C43: 3 | D43: 1
A44: NORM.S.INV | B44: =NORM.S.INV(R[-1]C) -> 2.9999999999999969
A45: NORMDIST | B45: =NORMDIST(R[-4]C[1],R[-4]C[2],R[-4]C[3],R[-4]C[4]) -> 0.63055865981823644
A46: NORMINV | B46: =NORMINV(R[-1]C,R[-5]C[2],R[-5]C[3]) -> 8.8817841970012523E-16
A47: NORMSDIST | B47: =NORMSDIST(RC[1]) -> 0.97724986805182079 | C47: 2
A48: NORMSINV | B48: =NORMSINV(R[-1]C) -> 2
A49: POISSON | B49: =POISSON(RC[1],RC[2],RC[3]) -> 0.40600584970983811 | C49: 1 | D49: 2 | E49: 1
A50: POISSON.DIST | B50: =POISSON.DIST(RC[1],RC[2],RC[3]) -> 0.27067056647322535 | C50: 1 | D50: 2 | E50: 0
A51: T.DIST | B51: =T.DIST(RC[1],RC[2],RC[3]) -> 0.99002893693400373 | C51: 3 | D51: 7 | E51: 1
A52: T.DIST.2T | B52: =T.DIST.2T(R[-1]C[1],R[-1]C[2]) -> 1.9942126131992539E-2
A53: T.DIST.RT | B53: =T.DIST.RT(R[-2]C[1],R[-2]C[2]) -> 9.9710630659962697E-3
A54: T.INV | B54: =T.INV(R[-3]C,R[-3]C[2]) -> 3
A55: T.INV.2T | B55: =T.INV.2T(R[-3]C,R[-4]C[2]) -> 3
A56: TDIST | B56: =TDIST(RC[1],RC[2],RC[3]) -> 1.9942126131992539E-2 | C56: 3 | D56: 7 | E56: 2
A57: TINV | B57: =TINV(R[-1]C,R[-1]C[2]) -> 3
A58: WEIBULL | B58: =WEIBULL(RC[1],RC[2],RC[3],RC[4]) -> 0.22119921692859512 | C58: 0.5 | D58: 2 | E58: 1 | F58: 1
A59: WEIBULL.DIST | B59: =WEIBULL.DIST(RC[1],RC[2],RC[3],RC[4]) -> 0.77880078307140488 | C59: 0.5 | D59: 2 | E59: 1 | F59: 0
A61: Descriptive Statistics
A62: AVEDEV | B62: =AVEDEV(RC[1]:RC[7],RC[8],ROW(RC)) -> 31.78125 | C62: 1 | D62: 2 | E62: 4 | F62: 8 | G62: 16 | H62: 32 | I62: 1 | J62: 128
A63: AVERAGE | B63: =AVERAGE(RC[1]:RC[7],RC[8],ROW(RC)) -> 31.75 | C63: 1 | D63: 2 | E63: 4 | F63: 8 | G63: 16 | H63: 32 | I63: 1 | J63: 128
A64: AVERAGEA | B64: =AVERAGEA(RC[1]:RC[7],RC[8],ROW(RC)) -> 28.444444444444443 | C64: 1 | D64: 2 | E64: 4 | F64: 8 | G64: 16 | H64: 32 | I64: 1 | J64: 128
A65: AVERAGEIF | B65: =AVERAGEIF(RC[1]:RC[7],RC[8]) -> 3.75 | C65: 1 | D65: 2 | E65: 4 | F65: 8 | G65: 16 | H65: 32 | I65: 1 | J65: <10
A66: AVERAGEIFS | B66: =AVERAGEIFS(RC[1]:RC[7],RC[1]:RC[7],">3",RC[1]:RC[7],"<20") -> 9.3333333333333339 | C66: 1 | D66: 2 | E66: 4 | F66: 8 | G66: 16 | H66: 32 | I66: 1 | J66: <10
A67: CORREL | B67: =CORREL({2,1,3,4,7,11},RC[1]:RC[6]) -> 0.98624138261245542 | C67: 1 | D67: 2 | E67: 3 | F67: 5 | G67: 8 | H67: 13
A68: COUNT | B68: =COUNT(RC[1]:RC[8]) -> 6 | C68: 1 | D68: 2 | E68: 4 | F68: 8 | G68: 16 | H68: 32 | I68: 1
A69: COUNTA | B69: =COUNTA(RC[1]:RC[8]) -> 7 | C69: 1 | D69: 2 | E69: 4 | F69: 8 | G69: 16 | H69: 32 | I69: 1
A70: COUNTBLANK | B70: =COUNTBLANK(RC[1]:RC[8]) -> 1 | C70: 1 | D70: 2 | E70: 4 | F70: 8 | G70: 16 | H70: 32 | I70: 1
A71: COUNTIF | B71: =COUNTIF(RC[1]:RC[7],RC[8]) -> 2 | C71: 1 | D71: 2 | E71: 4 | F71: 8 | G71: 16 | H71: 32 | I71: 1 | J71: >10
A72: COUNTIFS | B72: =COUNTIFS(RC[1]:RC[7],RC[8],RC[1]:RC[7],R[-1]C[8]) -> 1 | C72: 1 | D72: 2 | E72: 4 | F72: 8 | G72: 16 | H72: 32 | I72: 1 | J72: <30
A73: COVAR | B73: =COVAR(RC[1]:RC[6],R[1]C[1]:R[1]C[6]) -> 36.333333333333336 | C73: 1 | D73: 2 | E73: 4 | F73: 8 | G73: 16 | H73: 32 | I73: 1
A74: COVARIANCE.P | B74: =COVARIANCE.P(R[-1]C[1]:R[-1]C[6],RC[1]:RC[6]) -> 36.333333333333336 | C74: 2 | D74: 1 | E74: 3 | F74: 4 | G74: 7 | H74: 11 | I74: 18
A75: COVARIANCE.S | B75: =COVARIANCE.S(R[-2]C[1]:R[-2]C[6],R[-1]C[1]:R[-1]C[6]) -> 43.6
A76: DEVSQ | B76: =DEVSQ(RC[1]:RC[7]) -> 703.5 | C76: 1 | D76: 2 | E76: 4 | F76: 8 | G76: 16 | H76: 32 | I76: 1
A77: GEOMEAN | B77: =GEOMEAN(RC[1]:RC[7]) -> 5.6568542494923797 | C77: 1 | D77: 2 | E77: 4 | F77: 8 | G77: 16 | H77: 32 | I77: 1
A78: HARMEAN | B78: =HARMEAN(RC[1]:RC[7]) -> 3.0476190476190474 | C78: 1 | D78: 2 | E78: 4 | F78: 8 | G78: 16 | H78: 32 | I78: 1
A79: KURT | B79: =KURT(RC[1]:RC[7]) -> 1.8749535902576664 | C79: 1 | D79: 2 | E79: 4 | F79: 8 | G79: 16 | H79: 32 | I79: 1
A80: LARGE | B80: =LARGE(RC[1]:RC[6],RC[7]) -> 8 | C80: 1 | D80: 2 | E80: 4 | F80: 8 | G80: 16 | H80: 32 | I80: 3
A81: MAX | B81: =MAX(RC[1]:RC[6],RC[7]) -> 32 | C81: 1 | D81: 2 | E81: 4 | F81: 8 | G81: 16 | H81: 32 | I81: 3
A82: MAXA | B82: =MAXA(RC[1]:RC[6],RC[7]) -> 32 | C82: 1 | D82: 2 | E82: 4 | F82: 8 | G82: 16 | H82: 32 | I82: 3
A83: MEDIAN | B83: =MEDIAN(RC[1]:RC[7]) -> 4 | C83: 1 | D83: 2 | E83: 4 | F83: 8 | G83: 16 | H83: 32 | I83: 3
A84: MIN | B84: =MIN(RC[1]:RC[7]) -> 1 | C84: 1 | D84: 2 | E84: 4 | F84: 8 | G84: 16 | H84: 32 | I84: 3
A85: MINA | B85: =MINA(RC[1]:RC[7]) -> 1 | C85: 1 | D85: 2 | E85: 4 | F85: 8 | G85: 16 | H85: 32 | I85: 3
A86: MODE | B86: =MODE(RC[1]:RC[7]) -> 16 | C86: 1 | D86: 2 | E86: 4 | F86: 8 | G86: 16 | H86: 16 | I86: 3
A87: MODE.MULT | B87: =MODE.MULT(RC[1]:RC[7]) -> 8 | C87: 1 | D87: 2 | E87: 4 | F87: 8 | G87: 8 | H87: 32 | I87: 3
A88: MODE.SNGL | B88: =MODE.SNGL(1,2,3,4,3,2,1,2,1,2,2) -> 2
A89: PERCENTILE | B89: =PERCENTILE(RC[1]:RC[6],RC[7]) -> 3 | C89: 1 | D89: 2 | E89: 4 | F89: 8 | G89: 16 | H89: 32 | I89: 0.3
A90: PERCENTILE.EXC | B90: =PERCENTILE.EXC(RC[1]:RC[6],RC[7]) -> 6 | C90: 1 | D90: 2 | E90: 4 | F90: 8 | G90: 16 | H90: 32 | I90: 0.5
A91: PERCENTILE.INC | B91: =PERCENTILE.INC(RC[1]:RC[6],RC[7]) -> 12 | C91: 1 | D91: 2 | E91: 4 | F91: 8 | G91: 16 | H91: 32 | I91: 0.7
A92: PERCENTRANK | B92: =PERCENTRANK(RC[1]:RC[6],RC[7]) -> 0.65 | C92: 1 | D92: 2 | E92: 4 | F92: 8 | G92: 16 | H92: 32 | I92: 10
A93: PERCENTRANK.EXC | B93: =PERCENTRANK.EXC(RC[1]:RC[6],RC[7]) -> 0.75 | C93: 1 | D93: 2 | E93: 4 | F93: 8 | G93: 16 | H93: 32 | I93: 20
A94: PERCENTRANK.INC | B94: =PERCENTRANK.INC(RC[1]:RC[6],RC[7]) -> 0.97499999999999998 | C94: 1 | D94: 2 | E94: 4 | F94: 8 | G94: 16 | H94: 32 | I94: 30
A95: QUARTILE | B95: =QUARTILE(RC[1]:RC[6],RC[7]) -> 14 | C95: 1 | D95: 2 | E95: 4 | F95: 8 | G95: 16 | H95: 32 | I95: 3
A96: QUARTILE.EXC | B96: =QUARTILE.EXC(RC[1]:RC[6],RC[7]) -> 6 | C96: 1 | D96: 2 | E96: 4 | F96: 8 | G96: 16 | H96: 32 | I96: 2
A97: QUARTILE.INC | B97: =QUARTILE.INC(RC[1]:RC[6],RC[7]) -> 2.5 | C97: 1 | D97: 2 | E97: 4 | F97: 8 | G97: 16 | H97: 32 | I97: 1
A98: RANK | B98: =RANK(4,RC[1]:RC[6]) -> 4 | C98: 1 | D98: 2 | E98: 4 | F98: 8 | G98: 16 | H98: 32 | I98: RANK(2,{4,6,8,7,5,3,1,2},2)
A99: RANK.AVG | B99: =RANK.AVG(4,RC[1]:RC[6]) -> 4 | C99: 1 | D99: 2 | E99: 4 | F99: 8 | G99: 16 | H99: 32 | I99: * note that the docs say you can specify an array
A100: RANK.EQ | B100: =RANK.EQ(4,RC[1]:RC[6]) -> 4 | C100: 1 | D100: 2 | E100: 4 | F100: 8 | G100: 16 | H100: 32 | I100: * but it appears that excel 2011 falters on those
A101: SKEW | B101: =SKEW(RC[1]:RC[6]) -> 1.4996929578604361 | C101: 1 | D101: 2 | E101: 4 | F101: 8 | G101: 16 | H101: 32
A102: SMALL | B102: =SMALL(RC[1]:RC[6],RC[7]) -> 4 | C102: 1 | D102: 2 | E102: 4 | F102: 8 | G102: 16 | H102: 32 | I102: 3
A103: STDEV | B103: =STDEV(RC[1]:RC[6],RC[7]) -> 13.098527725337247 | C103: 1 | D103: 2 | E103: 4 | F103: 8 | G103: 16 | H103: 32 | I103: 30
A104: STDEV.P | B104: =STDEV.P(RC[1]:RC[6],RC[7]) -> 12.126880245545262 | C104: 1 | D104: 2 | E104: 4 | F104: 8 | G104: 16 | H104: 32 | I104: 30
A105: STDEV.S | B105: =STDEV.S(RC[1]:RC[6],RC[7]) -> 13.098527725337247 | C105: 1 | D105: 2 | E105: 4 | F105: 8 | G105: 16 | H105: 32 | I105: 30
A106: STDEVA | B106: =STDEVA(RC[1]:RC[6],RC[7]) -> 13.098527725337247 | C106: 1 | D106: 2 | E106: 4 | F106: 8 | G106: 16 | H106: 32 | I106: 30
A107: STDEVP | B107: =STDEVP(RC[1]:RC[6],RC[7]) -> 12.126880245545262 | C107: 1 | D107: 2 | E107: 4 | F107: 8 | G107: 16 | H107: 32 | I107: 30
A108: STDEVPA | B108: =STDEVPA(RC[1]:RC[6],RC[7]) -> 12.126880245545262 | C108: 1 | D108: 2 | E108: 4 | F108: 8 | G108: 16 | H108: 32 | I108: 30
A109: TRIMMEAN
A110: VAR | B110: =VAR(RC[1]:RC[6],RC[7]) -> 171.57142857142856 | C110: 1 | D110: 2 | E110: 4 | F110: 8 | G110: 16 | H110: 32 | I110: 30
A111: VAR.P | B111: =VAR.P(RC[1]:RC[6],RC[7]) -> 147.0612244897959 | C111: 1 | D111: 2 | E111: 4 | F111: 8 | G111: 16 | H111: 32 | I111: 30
A112: VAR.S | B112: =VAR.S(RC[1]:RC[6],RC[7]) -> 171.57142857142856 | C112: 1 | D112: 2 | E112: 4 | F112: 8 | G112: 16 | H112: 32 | I112: 30
A113: VARA | B113: =VARA(RC[1]:RC[6],RC[7]) -> 171.57142857142856 | C113: 1 | D113: 2 | E113: 4 | F113: 8 | G113: 16 | H113: 32 | I113: 30
A114: VARP | B114: =VARP(RC[1]:RC[6],RC[7]) -> 147.0612244897959 | C114: 1 | D114: 2 | E114: 4 | F114: 8 | G114: 16 | H114: 32 | I114: 30
A115: VARPA | B115: =VARPA(RC[1]:RC[6],RC[7]) -> 147.0612244897959 | C115: 1 | D115: 2 | E115: 4 | F115: 8 | G115: 16 | H115: 32 | I115: 30
A117: Statistical Tests
A118: CHISQ.TEST | B118: =CHISQ.TEST(RC[2]:RC[7],R[1]C[2]:R[1]C[7]) -> 0.76649193674651417 | D118: 1 | E118: 2 | F118: 3 | G118: 4 | H118: 5 | I118: 6
A119: CHITEST | B119: =CHITEST(RC[2]:RC[7],R[-1]C[2]:R[-1]C[7]) -> 0.55181804073002705 | D119: 1.1000000000000001 | E119: 2.2000000000000002 | F119: 3.1 | G119: 7 | H119: 4 | I119: 9
A120: F.TEST | B120: =F.TEST(R[-2]C[2]:R[-2]C[7],R[-1]C[2]:R[-1]C[7]) -> 0.31774423874816832
A121: FTEST | B121: =FTEST(R[-2]C[2]:R[-2]C[7],R[-3]C[2]:R[-3]C[7]) -> 0.31774423874816832
A122: T.TEST | B122: =T.TEST(R[-4]C[2]:R[-4]C[7],R[-3]C[2]:R[-3]C[7],RC[1],RC[2]) -> 0.55113345694457505 | C122: 2 | D122: 3
A123: TTEST | B123: =TTEST(R[-5]C[2]:R[-5]C[7],R[-4]C[2]:R[-4]C[7],R[-1]C[1],R[-1]C[2]) -> 0.55113345694457505
A124: Z.TEST | B124: =Z.TEST(RC[2]:RC[7],RC[1]) -> 0.39075564749935676 | C124: 3 | D124: 1 | E124: 2 | F124: 3 | G124: 4 | H124: 5 | I124: 4
A125: ZTEST | B125: =ZTEST(R[-1]C[2]:R[-1]C[7],R[-1]C[1],RC[1]) -> 0.46746265582105867 | C125: 5
A127: Regression and Friends
A128: FORECAST | B128: =FORECAST(RC[1],R[1]C[2]:R[1]C[7],RC[2]:RC[7]) -> 19.628571428571426 | C128: 10 | D128: 1 | E128: 2 | F128: 3 | G128: 4 | H128: 5 | I128: 6
A129: FREQUENCY | B129: =FREQUENCY(R[-1]C[2]:R[-1]C[7],RC[2]:RC[7]) -> 2 | D129: 2 | E129: 4 | F129: 6 | G129: 8 | H129: 11 | I129: 11
A130: GROWTH | B130: =GROWTH(R[-1]C[2]:R[-1]C[7],R[-2]C[2]:R[-2]C[7]) -> 2.5725901588088202 | D130: 0.1 | E130: 0.1 | F130: 0.2 | G130: 0.2 | H130: 0.2 | I130: 0.2
A131: INTERCEPT | B131: =INTERCEPT(R[-2]C[2]:R[-2]C[7],R[-3]C[2]:R[-3]C[7]) -> 0.20000000000000018
A132: PROB | B132: =PROB(R[-4]C[2]:R[-4]C[7],R[-2]C[2]:R[-2]C[7],RC[1],RC[2]) -> 0.4 | C132: 2.1 | D132: 4.5
A133: PEARSON | B133: =PEARSON(R[-15]C[2]:R[-15]C[7],R[-14]C[2]:R[-14]C[7]) -> 0.86469929256476752
A134: RSQ | B134: =RSQ(R[-5]C[2]:R[-5]C[7],R[-6]C[2]:R[-6]C[7]) -> 0.97142857142857142
A135: SLOPE | B135: =SLOPE(R[-6]C[2]:R[-6]C[7],R[-7]C[2]:R[-7]C[7]) -> 1.9428571428571428
A136: STEYX | B136: =STEYX(R[-7]C[2]:R[-7]C[7],R[-8]C[2]:R[-8]C[7]) -> 0.69693205243716838
D137: LINEST (n+1 by 5) | H137: LOGEST (n+1 by 5)
A138: LINEST | B138: =LINEST(R[-9]C[2]:R[-9]C[7],R[-10]C[2]:R[-10]C[7]) -> 1.9428571428571431 | D138: =LINEST(R[-9]C:R[-9]C[5],R[-10]C:R[-10]C[5],TRUE,TRUE) -> 1.9428571428571431 | E138: 0.19999999999999929 | H138: =LOGEST(R[-9]C[-4]:R[-9]C[1],R[-10]C[-4]:R[-10]C[1],TRUE,TRUE) -> 1.4027906571323456 | I138: 1.8339088200571829
A139: LOGEST | B139: =LOGEST(R[-10]C[2]:R[-10]C[7],R[-11]C[2]:R[-11]C[7]) -> 1.4027906571323456 | D139: 0.16659862556700861 | E139: 0.64880843162861335 | H139: 5.1290820456947078E-2 | I139: 0.1997490475347993
A140: TREND | B140: =TREND(R[-11]C[2]:R[-11]C[7],R[-12]C[2]:R[-12]C[7]) -> 2.1428571428571423 | D140: 0.97142857142857131 | E140: 0.69693205243716971 | H140: 0.91587029395585617 | I140: 0.21456489602231923
D141: 135.99999999999994 | E141: 4 | H141: 43.545631478863783 | I141: 4
D142: 66.05714285714285 | E142: 1.9428571428571435 | H142: 2.004757901661387 | I142: 0.18415237842027465
A144: TREND | D144: =TREND(R[-15]C:R[-15]C[5],R[-16]C:R[-16]C[5]) -> 2.1428571428571423 | E144: 4.0857142857142854 | F144: 6.0285714285714285 | G144: 7.9714285714285715 | H144: 9.9142857142857146 | I144: 11.857142857142858

Sheet: Text
A1: Operators
A2: CONCATENATE | B2: =CONCATENATE(RC[1],RC[2],RC[3],RC[4]) -> Foobarbazqux | C2: Foo | D2: bar | E2: baz | F2: qux
A3: EXACT | B3: =EXACT(RC[1],RC[2]) -> 0 | C3: foo | D3: Foo
A4: LEN | B4: =LEN(RC[1]) -> 15 | C4: foo bar baz qux
A5: LENB | B5: =LENB(R[-1]C[1]) -> 15
A7: Casing
A8: LOWER | B8: =LOWER(RC[1]) -> foo bar baz qux | C8: foo bAR BAZ Qux
A9: PROPER | B9: =PROPER(RC[1]) -> Foo Bar Baz Qux | C9: foo bAR BAZ Qux
A10: UPPER | B10: =UPPER(RC[1]) -> FOO BAR BAZ QUX | C10: foo bAR BAZ Qux
A12: Formatting
A13: DOLLAR | B13: =DOLLAR(RC[1]) -> $4.57 | C13: 4.5670000000000002
A14: FIXED | B14: =FIXED(RC[1],5) -> 0.12346 | C14: 0.12345679
A15: TEXT | B15: =TEXT(RC[1],RC[2]) -> 1977-07-07 | C15: 1977-07-07T00:00:00.000 | D15: ee-mm-dd
A16: T | B16: =T(RC[1]) ->  | C16: 0
A17: VALUE | B17: =VALUE(RC[1]) -> 12 | C17: 12
A19: Codepoints
A20: CHAR | B20: =CHAR(RC[1]) -> ð | C20: 240
A21: CODE | B21: =CODE(RC[1]) -> 63 | C21: 
A23: Extracting Text
A24: LEFT | B24: =LEFT(RC[1],RC[2]) -> foo | C24: foo bar baz qux | D24: 3
A25: LEFTB | B25: =LEFTB(R[-1]C[1],R[-1]C[2]) -> foo
A26: MID | B26: =MID(RC[1],RC[2],RC[3]) -> bar | C26: foo bar baz qux | D26: 5 | E26: 3
A27: MIDB | B27: =MIDB(RC[1],RC[2],RC[3]) -> baz | C27: foo bar baz qux | D27: 9 | E27: 3
A28: RIGHT | B28: =RIGHT(R[-4]C[1],R[-4]C[2]) -> qux
A29: RIGHTB | B29: =RIGHT(R[-5]C[1],R[-5]C[2]) -> qux
A31: Searching
A32: FIND | B32: =FIND(RC[1],RC[2]) -> 9 | C32: b | D32: foo Bar baz qux
A33: FINDB | B33: =FINDB(R[-1]C[1],R[-1]C[2]) -> 9
A34: SEARCH | B34: =SEARCH(R[-2]C[1],R[-2]C[2]) -> 5
A35: SEARCHB | B35: =SEARCHB(R[-3]C[1],R[-3]C[2]) -> 5
A37: Manipulating Text | B37: =REPT("badger ",12)&REPT("MUSHROOM! ",2) -> badger badger badger badger badger badger badger badger badger badger badger badger MUSHROOM! MUSHROOM!
A38: CLEAN | B38: =CLEAN(RC[1]) -> 7 | C38: =CHAR(7)&"7"&CHAR(7) -> 7
A39: REPT | B39: =REPT(RC[1],RC[2]) -> badgerbadgerbadger | C39: badger | D39: 3
A40: REPLACE | B40: =REPLACE(RC[1],RC[2],RC[3],RC[4]) -> foo FOO baz qux | C40: foo bar baz qux | D40: 4 | E40: 4 | F40: FOO
A41: REPLACEB | B41: =REPLACEB(R[-1]C[1],R[-1]C[2],R[-1]C[3],R[-1]C[4]) -> foo FOO baz qux
A42: SUBSTITUTE | B42: =SUBSTITUTE(RC[1],RC[2],RC[3],RC[4]) -> foo bor baz qux | C42: foo bar baz qux | D42: a | E42: o | F42: 1
A43: TRIM | B43: =TRIM(RC[1]) -> there are two spaces here | C43: there are two spaces here
A45: Asian Features
A46: ASC | B46: =ASC(RC[1]) -> 
A47: PHONETIC | B47: =PHONETIC(RC[1]) -> #N/A | C47: foo bar baz qux
A48: JIS | B48: =JIS(RC[1]) -> #NAME?
A49: YEN | B49: =YEN(RC[1]) -> #NAME? | C49: 5