Sheet: Named Ranges
A1: col1 | B1: col2 | C1: col3
A2: 1 | B2: =2*RC[-1] -> 2 | C2: =RC[-2]*RC[-1] -> 2 | E2: =SUM(col3_) -> 110
A3: 2 | B3: =2*RC[-1] -> 4 | C3: =RC[-2]*RC[-1] -> 8 | E3: =SUM(col2_) -> #NAME?
A4: 3 | B4: =2*RC[-1] -> 6 | C4: =RC[-2]*RC[-1] -> 18 | E4: =SUM(col1_) -> 15
A5: 4 | B5: =2*RC[-1] -> 8 | C5: =RC[-2]*RC[-1] -> 32
A6: 5 | B6: =2*RC[-1] -> 10 | C6: =RC[-2]*RC[-1] -> 50
A7: 6 | B7: =2*RC[-1] -> 12 | C7: =RC[-2]*RC[-1] -> 72 | D7: row6 | E7: =SLOPE(col1_,col2_) -> #NAME?
E8: =SLOPE(col1_,col3_) -> 8.0213903743315509E-2

Sheet: Cross-Sheet
A1: 1 | B1: 2 | C1: 3 | D1: =SUM(named_ranges_2011.xlsx.xml!col1_) -> 15 | E1: =SUM(named_ranges_2011.xlsx.xml!col2_) -> #NAME? | F1: =SUM(named_ranges_2011.xlsx.xml!col3_) -> 110
D2: =SUM('Named Ranges'!RC[-3]:R[5]C[-3]) -> 21 | E2: =SUM(col1_) -> 15