Sheet: PTWithLabelFilter
A1: Foo | B1: (Multiple Items)
A3: Count of Qux | B3: Column Labels
A4: Row Labels | B4: 10 | C4: 14 | D4: 18 | E4: 22 | F4: 26 | G4: 30 | H4: 34 | I4: 38 | J4: Grand Total
B5: 1 | C5: 1 | E5: 1 | F5: 1 | H5: 1 | I5: 1 | J5: 6
A6: 7 | C6: 1 | J6: 1
A7: 11 | E7: 1 | J7: 1
A8: 13 | F8: 1 | J8: 1
A9: 17 | H9: 1 | J9: 1
A10: 19 | I10: 1 | J10: 1
A11: buzz | B11: 1 | J11: 1
A12: fizz | D12: 1 | G12: 1 | J12: 2
A13: fizz | D13: 1 | J13: 1
A14: fizzbuzz | G14: 1 | J14: 1
A15: Grand Total | B15: 1 | C15: 1 | D15: 1 | E15: 1 | F15: 1 | G15: 1 | H15: 1 | I15: 1 | J15: 8

Sheet: FizzBuzzTable
A1: Foo | B1: Bar | C1: Baz | D1: Qux | E1: Quux
A2: 1 | B2: =RC[-1]*2 -> 2 | C2: =IF(MOD(RC[-2],3)=0,"fizz","") ->  | D2: =IF(MOD(RC[-3],5)=0,"buzz","") ->  | E2: =IF(LEN(RC[-2]&RC[-1])=0,RC[-4],RC[-2]&RC[-1]) -> 1
A3: 2 | B3: =RC[-1]*2 -> 4 | C3: =IF(MOD(RC[-2],3)=0,"fizz","") ->  | D3: =IF(MOD(RC[-3],5)=0,"buzz","") ->  | E3: =IF(LEN(RC[-2]&RC[-1])=0,RC[-4],RC[-2]&RC[-1]) -> 2
A4: 3 | B4: =RC[-1]*2 -> 6 | C4: =IF(MOD(RC[-2],3)=0,"fizz","") -> fizz | D4: =IF(MOD(RC[-3],5)=0,"buzz","") ->  | E4: =IF(LEN(RC[-2]&RC[-1])=0,RC[-4],RC[-2]&RC[-1]) -> fizz
A5: 4 | B5: =RC[-1]*2 -> 8 | C5: =IF(MOD(RC[-2],3)=0,"fizz","") ->  | D5: =IF(MOD(RC[-3],5)=0,"buzz","") ->  | E5: =IF(LEN(RC[-2]&RC[-1])=0,RC[-4],RC[-2]&RC[-1]) -> 4
A6: 5 | B6: =RC[-1]*2 -> 10 | C6: =IF(MOD(RC[-2],3)=0,"fizz","") ->  | D6: =IF(MOD(RC[-3],5)=0,"buzz","") -> buzz | E6: =IF(LEN(RC[-2]&RC[-1])=0,RC[-4],RC[-2]&RC[-1]) -> buzz
A7: 6 | B7: =RC[-1]*2 -> 12 | C7: =IF(MOD(RC[-2],3)=0,"fizz","") -> fizz | D7: =IF(MOD(RC[-3],5)=0,"buzz","") ->  | E7: =IF(LEN(RC[-2]&RC[-1])=0,RC[-4],RC[-2]&RC[-1]) -> fizz
A8: 7 | B8: =RC[-1]*2 -> 14 | C8: =IF(MOD(RC[-2],3)=0,"fizz","") ->  | D8: =IF(MOD(RC[-3],5)=0,"buzz","") ->  | E8: =IF(LEN(RC[-2]&RC[-1])=0,RC[-4],RC[-2]&RC[-1]) -> 7
A9: 8 | B9: =RC[-1]*2 -> 16 | C9: =IF(MOD(RC[-2],3)=0,"fizz","") ->  | D9: =IF(MOD(RC[-3],5)=0,"buzz","") ->  | E9: =IF(LEN(RC[-2]&RC[-1])=0,RC[-4],RC[-2]&RC[-1]) -> 8
A10: 9 | B10: =RC[-1]*2 -> 18 | C10: =IF(MOD(RC[-2],3)=0,"fizz","") -> fizz | D10: =IF(MOD(RC[-3],5)=0,"buzz","") ->  | E10: =IF(LEN(RC[-2]&RC[-1])=0,RC[-4],RC[-2]&RC[-1]) -> fizz
A11: 10 | B11: =RC[-1]*2 -> 20 | C11: =IF(MOD(RC[-2],3)=0,"fizz","") ->  | D11: =IF(MOD(RC[-3],5)=0,"buzz","") -> buzz | E11: =IF(LEN(RC[-2]&RC[-1])=0,RC[-4],RC[-2]&RC[-1]) -> buzz
A12: 11 | B12: =RC[-1]*2 -> 22 | C12: =IF(MOD(RC[-2],3)=0,"fizz","") ->  | D12: =IF(MOD(RC[-3],5)=0,"buzz","") ->  | E12: =IF(LEN(RC[-2]&RC[-1])=0,RC[-4],RC[-2]&RC[-1]) -> 11
A13: 12 | B13: =RC[-1]*2 -> 24 | C13: =IF(MOD(RC[-2],3)=0,"fizz","") -> fizz | D13: =IF(MOD(RC[-3],5)=0,"buzz","") ->  | E13: =IF(LEN(RC[-2]&RC[-1])=0,RC[-4],RC[-2]&RC[-1]) -> fizz
A14: 13 | B14: =RC[-1]*2 -> 26 | C14: =IF(MOD(RC[-2],3)=0,"fizz","") ->  | D14: =IF(MOD(RC[-3],5)=0,"buzz","") ->  | E14: =IF(LEN(RC[-2]&RC[-1])=0,RC[-4],RC[-2]&RC[-1]) -> 13
A15: 14 | B15: =RC[-1]*2 -> 28 | C15: =IF(MOD(RC[-2],3)=0,"fizz","") ->  | D15: =IF(MOD(RC[-3],5)=0,"buzz","") ->  | E15: =IF(LEN(RC[-2]&RC[-1])=0,RC[-4],RC[-2]&RC[-1]) -> 14
A16: 15 | B16: =RC[-1]*2 -> 30 | C16: =IF(MOD(RC[-2],3)=0,"fizz","") -> fizz | D16: =IF(MOD(RC[-3],5)=0,"buzz","") -> buzz | E16: =IF(LEN(RC[-2]&RC[-1])=0,RC[-4],RC[-2]&RC[-1]) -> fizzbuzz
A17: 16 | B17: =RC[-1]*2 -> 32 | C17: =IF(MOD(RC[-2],3)=0,"fizz","") ->  | D17: =IF(MOD(RC[-3],5)=0,"buzz","") ->  | E17: =IF(LEN(RC[-2]&RC[-1])=0,RC[-4],RC[-2]&RC[-1]) -> 16
A18: 17 | B18: =RC[-1]*2 -> 34 | C18: =IF(MOD(RC[-2],3)=0,"fizz","") ->  | D18: =IF(MOD(RC[-3],5)=0,"buzz","") ->  | E18: =IF(LEN(RC[-2]&RC[-1])=0,RC[-4],RC[-2]&RC[-1]) -> 17
A19: 18 | B19: =RC[-1]*2 -> 36 | C19: =IF(MOD(RC[-2],3)=0,"fizz","") -> fizz | D19: =IF(MOD(RC[-3],5)=0,"buzz","") ->  | E19: =IF(LEN(RC[-2]&RC[-1])=0,RC[-4],RC[-2]&RC[-1]) -> fizz
A20: 19 | B20: =RC[-1]*2 -> 38 | C20: =IF(MOD(RC[-2],3)=0,"fizz","") ->  | D20: =IF(MOD(RC[-3],5)=0,"buzz","") ->  | E20: =IF(LEN(RC[-2]&RC[-1])=0,RC[-4],RC[-2]&RC[-1]) -> 19
A21: 20 | B21: =RC[-1]*2 -> 40 | C21: =IF(MOD(RC[-2],3)=0,"fizz","") ->  | D21: =IF(MOD(RC[-3],5)=0,"buzz","") -> buzz | E21: =IF(LEN(RC[-2]&RC[-1])=0,RC[-4],RC[-2]&RC[-1]) -> buzz

Sheet: PTTable
A4: Count of Quux | B4: Column Labels
A5: Row Labels | C5: buzz | D5: Grand Total
A6: Group1
B7: 11 | C7: 3 | D7: 14
A8: fizz | B8: 5 | C8: 1 | D8: 6
A9: Grand Total | B9: 16 | C9: 4 | D9: 20

Sheet: PTRange
A1: Foo | B1: (All)
A2: Bar | B2: (Multiple Items)
A4: Count of Quux | B4: Column Labels
A5: Row Labels | C5: buzz | D5: Grand Total
A6: Group1
B7: 0.9 | C7: 1.5 | D7: 1
A8: fizz | B8: 1.2 | C8: 0 | D8: 1
A9: Grand Total | B9: 1 | C9: 1 | D9: 1