Sheet: Visible
A1: v | B1: i | C1: s | D1: i | E1: b | F1: l | G1: e
A2: =CODE(R[-1]C) -> 118 | B2: =CODE(R[-1]C) -> 105 | C2: =CODE(R[-1]C) -> 115 | D2: =CODE(R[-1]C) -> 105 | E2: =CODE(R[-1]C) -> 98 | F2: =CODE(R[-1]C) -> 108 | G2: =CODE(R[-1]C) -> 101

Sheet: Hidden
A1: H | B1: i | C1: d | D1: d | E1: e | F1: n
A2: =CODE(R[-1]C) -> 72 | B2: =CODE(R[-1]C) -> 105 | C2: =CODE(R[-1]C) -> 100 | D2: =CODE(R[-1]C) -> 100 | E2: =CODE(R[-1]C) -> 101 | F2: =CODE(R[-1]C) -> 110

Sheet: VeryHidden
A1: V | B1: e | C1: r | D1: y | E1: H | F1: i | G1: d | H1: d | I1: e | J1: n
A2: =CODE(R[-1]C) -> 86 | B2: =CODE(R[-1]C) -> 101 | C2: =CODE(R[-1]C) -> 114 | D2: =CODE(R[-1]C) -> 121 | E2: =CODE(R[-1]C) -> 72 | F2: =CODE(R[-1]C) -> 105 | G2: =CODE(R[-1]C) -> 100 | H2: =CODE(R[-1]C) -> 100 | I2: =CODE(R[-1]C) -> 101 | J2: =CODE(R[-1]C) -> 110