Sheet: test
A1: value | B1: date1904 | C1: val1900 | D1: format | E1: formula | F1: expected | G1: correct | H1: desc
A2: =4018.99999998843 -> 4018.9999999884299 | B2: 0 | C2: =IF(RC[-1],RC[-2]+1462,RC[-2]) -> 4018.9999999884299 | D2: mm/dd/yyyy hh:mm:ss.000 | E2: =TEXT(RC[-4],RC[-1]) -> 12/31/1910 23:59:59.999 | F2: 12/31/1910 23:59:59.999 | G2: =RC[-2]=RC[-1] -> 1 | H2: end-of-year thousandths rounding
A3: =R[-1]C -> 4018.9999999884299 | B3: 0 | C3: =IF(RC[-1],RC[-2]+1462,RC[-2]) -> 4018.9999999884299 | D3: mm/dd/yyyy hh:mm:ss.00 | E3: =TEXT(RC[-4],RC[-1]) -> 01/01/1911 00:00:00.00 | F3: 01/01/1911 00:00:00.00 | G3: =RC[-2]=RC[-1] -> 1 | H3: end-of-year hundredths round up
A4: =R[-1]C -> 4018.9999999884299 | B4: 0 | C4: =IF(RC[-1],RC[-2]+1462,RC[-2]) -> 4018.9999999884299 | D4: mm/dd/yyyy hh:mm | E4: =TEXT(RC[-4],RC[-1]) -> 01/01/1911 00:00 | F4: 01/01/1911 00:00 | G4: =RC[-2]=RC[-1] -> 1 | H4: end-of-year minutes round up
A5: =R[-1]C -> 4018.9999999884299 | B5: 0 | C5: =IF(RC[-1],RC[-2]+1462,RC[-2]) -> 4018.9999999884299 | D5: [hh]:mm:ss.000 | E5: =TEXT(RC[-4],RC[-1]) -> 96455:59:59.999 | F5: 96455:59:59.999 | G5: =RC[-2]=RC[-1] -> 1 | H5: hour duration thousandths rounding
A6: =R[-1]C -> 4018.9999999884299 | B6: 0 | C6: =IF(RC[-1],RC[-2]+1462,RC[-2]) -> 4018.9999999884299 | D6: [hh]:mm:ss.00 | E6: =TEXT(RC[-4],RC[-1]) -> 96456:00:00.00 | F6: 96456:00:00.00 | G6: =RC[-2]=RC[-1] -> 1 | H6: hour duration hundredths round up
A7: =R[-1]C -> 4018.9999999884299 | B7: 0 | C7: =IF(RC[-1],RC[-2]+1462,RC[-2]) -> 4018.9999999884299 | D7: [hh]:mm:ss | E7: =TEXT(RC[-4],RC[-1]) -> 96456:00:00 | F7: 96456:00:00 | G7: =RC[-2]=RC[-1] -> 1 | H7: hour duration minute round up (w/ ss)
A8: =R[-1]C -> 4018.9999999884299 | B8: 0 | C8: =IF(RC[-1],RC[-2]+1462,RC[-2]) -> 4018.9999999884299 | D8: [hh]:mm | E8: =TEXT(RC[-4],RC[-1]) -> 96456:00 | F8: 96456:00 | G8: =RC[-2]=RC[-1] -> 1 | H8: hour duration minute round up
A9: =R[-1]C -> 4018.9999999884299 | B9: 0 | C9: =IF(RC[-1],RC[-2]+1462,RC[-2]) -> 4018.9999999884299 | D9: [hh] | E9: =TEXT(RC[-4],RC[-1]) -> 96456 | F9: 96456 | G9: =RC[-2]=RC[-1] -> 1 | H9: hour duration round up
A10: =R[-1]C -> 4018.9999999884299 | B10: 0 | C10: =IF(RC[-1],RC[-2]+1462,RC[-2]) -> 4018.9999999884299 | D10: [mm]:ss.000 | E10: =TEXT(RC[-4],RC[-1]) -> 5787359:59.999 | F10: 5787359:59.999 | G10: =RC[-2]=RC[-1] -> 1 | H10: minute duration thousandths rounding
A11: =R[-1]C -> 4018.9999999884299 | B11: 0 | C11: =IF(RC[-1],RC[-2]+1462,RC[-2]) -> 4018.9999999884299 | D11: [mm]:ss.00 | E11: =TEXT(RC[-4],RC[-1]) -> 5787360:00.00 | F11: 5787360:00.00 | G11: =RC[-2]=RC[-1] -> 1 | H11: minute duration hundredths round up
A12: =R[-1]C -> 4018.9999999884299 | B12: 0 | C12: =IF(RC[-1],RC[-2]+1462,RC[-2]) -> 4018.9999999884299 | D12: [mm]:ss | E12: =TEXT(RC[-4],RC[-1]) -> 5787360:00 | F12: 5787360:00 | G12: =RC[-2]=RC[-1] -> 1 | H12: minute duration round up
A13: =R[-1]C -> 4018.9999999884299 | B13: 0 | C13: =IF(RC[-1],RC[-2]+1462,RC[-2]) -> 4018.9999999884299 | D13: [ss].000 | E13: =TEXT(RC[-4],RC[-1]) -> 347241599.999 | F13: 347241599.999 | G13: =RC[-2]=RC[-1] -> 1 | H13: second duration thousandths rounding
A14: =R[-1]C -> 4018.9999999884299 | B14: 0 | C14: =IF(RC[-1],RC[-2]+1462,RC[-2]) -> 4018.9999999884299 | D14: [ss].00 | E14: =TEXT(RC[-4],RC[-1]) -> 347241600.00 | F14: 347241600.00 | G14: =RC[-2]=RC[-1] -> 1 | H14: second duration hundredths round up
A15: =R[-1]C -> 4018.9999999884299 | B15: 0 | C15: =IF(RC[-1],RC[-2]+1462,RC[-2]) -> 4018.9999999884299 | D15: [ss] | E15: =TEXT(RC[-4],RC[-1]) -> 347241600 | F15: 347241600 | G15: =RC[-2]=RC[-1] -> 1 | H15: second duration round up
A16: 6.8999999999999997E-4 | B16: 0 | C16: =IF(RC[-1],RC[-2]+1462,RC[-2]) -> 6.8999999999999997E-4 | D16: yyyy mmm ddd dd hh:mm:ss | E16: =TEXT(RC[-2],RC[-1]) -> 1900 Jan Sat 00 00:01:00 | F16: 1900 Jan Sat 00 00:01:00 | G16: =RC[-2]=RC[-1] -> 1 | H16: rounds up to 1 minute
A17: 1.3879999999999999E-3 | B17: 0 | C17: =IF(RC[-1],RC[-2]+1462,RC[-2]) -> 1.3879999999999999E-3 | D17: yyyy mmm ddd dd hh:mm:ss | E17: =TEXT(RC[-2],RC[-1]) -> 1900 Jan Sat 00 00:02:00 | F17: 1900 Jan Sat 00 00:02:00 | G17: =RC[-2]=RC[-1] -> 1 | H17: rounds up to 2 munutes
A18: 6.94E-3 | B18: 0 | C18: =IF(RC[-1],RC[-2]+1462,RC[-2]) -> 6.94E-3 | D18: yyyy mmm ddd dd hh:mm:ss | E18: =TEXT(RC[-2],RC[-1]) -> 1900 Jan Sat 00 00:10:00 | F18: 1900 Jan Sat 00 00:10:00 | G18: =RC[-2]=RC[-1] -> 1 | H18: rounds up to 10 minutes
A19: 8.3330000000000001E-2 | B19: 0 | C19: =IF(RC[-1],RC[-2]+1462,RC[-2]) -> 8.3330000000000001E-2 | D19: yyyy mmm ddd dd hh:mm:ss | E19: =TEXT(RC[-2],RC[-1]) -> 1900 Jan Sat 00 02:00:00 | F19: 1900 Jan Sat 00 02:00:00 | G19: =RC[-2]=RC[-1] -> 1 | H19: rounds up to 2 hours
A20: 0.99999899999999997 | B20: 0 | C20: =IF(RC[-1],RC[-2]+1462,RC[-2]) -> 0.99999899999999997 | D20: yyyy mmm ddd dd hh:mm:ss | E20: =TEXT(RC[-2],RC[-1]) -> 1900 Jan Sun 01 00:00:00 | F20: 1900 Jan Sun 01 00:00:00 | G20: =RC[-2]=RC[-1] -> 1 | H20: rounds up day
A21: 31.999998999999999 | B21: 0 | C21: =IF(RC[-1],RC[-2]+1462,RC[-2]) -> 31.999998999999999 | D21: yyyy mmm ddd dd hh:mm:ss | E21: =TEXT(RC[-2],RC[-1]) -> 1900 Feb Wed 01 00:00:00 | F21: 1900 Feb Wed 01 00:00:00 | G21: =RC[-2]=RC[-1] -> 1 | H21: rounds up month
A22: 59.999999000000003 | B22: 0 | C22: =IF(RC[-1],RC[-2]+1462,RC[-2]) -> 59.999999000000003 | D22: yyyy mmm ddd dd hh:mm:ss | E22: =TEXT(RC[-2],RC[-1]) -> 1900 Feb Wed 29 00:00:00 | F22: 1900 Feb Wed 29 00:00:00 | G22: =RC[-2]=RC[-1] -> 1 | H22: rounds up to 1900 leap day
A23: 60.999999000000003 | B23: 0 | C23: =IF(RC[-1],RC[-2]+1462,RC[-2]) -> 60.999999000000003 | D23: yyyy mmm ddd dd hh:mm:ss | E23: =TEXT(RC[-2],RC[-1]) -> 1900 Mar Thu 01 00:00:00 | F23: 1900 Mar Thu 01 00:00:00 | G23: =RC[-2]=RC[-1] -> 1 | H23: rounds 1900 leap day up
A24: 77.999999000000003 | B24: 0 | C24: =IF(RC[-1],RC[-2]+1462,RC[-2]) -> 77.999999000000003 | D24: yyyy mmm ddd dd hh:mm:ss | E24: =TEXT(RC[-2],RC[-1]) -> 1900 Mar Sun 18 00:00:00 | F24: 1900 Mar Sun 18 00:00:00 | G24: =RC[-2]=RC[-1] -> 1 | H24: rounds up day in March
A25: 366.999999 | B25: 0 | C25: =IF(RC[-1],RC[-2]+1462,RC[-2]) -> 366.999999 | D25: yyyy mmm ddd dd hh:mm:ss | E25: =TEXT(RC[-2],RC[-1]) -> 1901 Jan Tue 01 00:00:00 | F25: 1901 Jan Tue 01 00:00:00 | G25: =RC[-2]=RC[-1] -> 1 | H25: rounds up leap year 1900
A26: 365.999999 | B26: 0 | C26: =IF(RC[-1],RC[-2]+1462,RC[-2]) -> 365.999999 | D26: yyyy mmm ddd dd hh:mm:ss | E26: =TEXT(RC[-2],RC[-1]) -> 1900 Dec Mon 31 00:00:00 | F26: 1900 Dec Mon 31 00:00:00 | G26: =RC[-2]=RC[-1] -> 1 | H26: rounds up leap year 1904
A27: 6.8999999999999997E-4 | B27: 1 | C27: =IF(RC[-1],RC[-2]+1462,RC[-2]) -> 1462.0006900000001 | D27: yyyy mmm ddd dd hh:mm:ss | E27: =TEXT(RC[-2],RC[-1]) -> 1904 Jan Fri 01 00:01:00 | F27: 1904 Jan Fri 01 00:01:00 | G27: =RC[-2]=RC[-1] -> 1 | H27: rounds up to 1 minute
A28: 1.3879999999999999E-3 | B28: 1 | C28: =IF(RC[-1],RC[-2]+1462,RC[-2]) -> 1462.0013879999999 | D28: yyyy mmm ddd dd hh:mm:ss | E28: =TEXT(RC[-2],RC[-1]) -> 1904 Jan Fri 01 00:02:00 | F28: 1904 Jan Fri 01 00:02:00 | G28: =RC[-2]=RC[-1] -> 1 | H28: rounds up to 2 munutes
A29: 6.94E-3 | B29: 1 | C29: =IF(RC[-1],RC[-2]+1462,RC[-2]) -> 1462.00694 | D29: yyyy mmm ddd dd hh:mm:ss | E29: =TEXT(RC[-2],RC[-1]) -> 1904 Jan Fri 01 00:10:00 | F29: 1904 Jan Fri 01 00:10:00 | G29: =RC[-2]=RC[-1] -> 1 | H29: rounds up to 10 minutes
A30: 8.3330000000000001E-2 | B30: 1 | C30: =IF(RC[-1],RC[-2]+1462,RC[-2]) -> 1462.0833299999999 | D30: yyyy mmm ddd dd hh:mm:ss | E30: =TEXT(RC[-2],RC[-1]) -> 1904 Jan Fri 01 02:00:00 | F30: 1904 Jan Fri 01 02:00:00 | G30: =RC[-2]=RC[-1] -> 1 | H30: rounds up to 2 hours
A31: 0.99999899999999997 | B31: 1 | C31: =IF(RC[-1],RC[-2]+1462,RC[-2]) -> 1462.9999989999999 | D31: yyyy mmm ddd dd hh:mm:ss | E31: =TEXT(RC[-2],RC[-1]) -> 1904 Jan Sat 02 00:00:00 | F31: 1904 Jan Sat 02 00:00:00 | G31: =RC[-2]=RC[-1] -> 1 | H31: rounds up day
A32: 31.999998999999999 | B32: 1 | C32: =IF(RC[-1],RC[-2]+1462,RC[-2]) -> 1493.9999989999999 | D32: yyyy mmm ddd dd hh:mm:ss | E32: =TEXT(RC[-2],RC[-1]) -> 1904 Feb Tue 02 00:00:00 | F32: 1904 Feb Tue 02 00:00:00 | G32: =RC[-2]=RC[-1] -> 1 | H32: rounds up month
A33: 59.999999000000003 | B33: 1 | C33: =IF(RC[-1],RC[-2]+1462,RC[-2]) -> 1521.9999990000001 | D33: yyyy mmm ddd dd hh:mm:ss | E33: =TEXT(RC[-2],RC[-1]) -> 1904 Mar Tue 01 00:00:00 | F33: 1904 Mar Tue 01 00:00:00 | G33: =RC[-2]=RC[-1] -> 1 | H33: rounds up to 1900 leap day
A34: 60.999999000000003 | B34: 1 | C34: =IF(RC[-1],RC[-2]+1462,RC[-2]) -> 1522.9999990000001 | D34: yyyy mmm ddd dd hh:mm:ss | E34: =TEXT(RC[-2],RC[-1]) -> 1904 Mar Wed 02 00:00:00 | F34: 1904 Mar Wed 02 00:00:00 | G34: =RC[-2]=RC[-1] -> 1 | H34: rounds 1900 leap day up
A35: 77.999999000000003 | B35: 1 | C35: =IF(RC[-1],RC[-2]+1462,RC[-2]) -> 1539.9999990000001 | D35: yyyy mmm ddd dd hh:mm:ss | E35: =TEXT(RC[-2],RC[-1]) -> 1904 Mar Sat 19 00:00:00 | F35: 1904 Mar Sat 19 00:00:00 | G35: =RC[-2]=RC[-1] -> 1 | H35: rounds up day in March
A36: 366.999999 | B36: 1 | C36: =IF(RC[-1],RC[-2]+1462,RC[-2]) -> 1828.9999990000001 | D36: yyyy mmm ddd dd hh:mm:ss | E36: =TEXT(RC[-2],RC[-1]) -> 1905 Jan Mon 02 00:00:00 | F36: 1905 Jan Mon 02 00:00:00 | G36: =RC[-2]=RC[-1] -> 1 | H36: rounds up leap year 1900
A37: 365.999999 | B37: 1 | C37: =IF(RC[-1],RC[-2]+1462,RC[-2]) -> 1827.9999990000001 | D37: yyyy mmm ddd dd hh:mm:ss | E37: =TEXT(RC[-2],RC[-1]) -> 1905 Jan Sun 01 00:00:00 | F37: 1905 Jan Sun 01 00:00:00 | G37: =RC[-2]=RC[-1] -> 1 | H37: rounds up leap year 1904